J_Nombre,nombre,fecha_de_adquisicion,descripcion
thoward0,Logro_0_Republican,2024-01-27,Hand successful item top fear structure.
thoward0,Logro_1_identify,2024-11-13,Probably economy after sport market when step.
thoward0,Logro_2_college,2024-09-06,Environmental investment official out table fight understand.
pattersongina1,Logro_0_describe,2024-10-06,Throw bad perform attorney somebody school.
pattersongina1,Logro_1_various,2024-07-29,Beautiful heavy your.
pattersongina1,Logro_2_coach,2024-01-07,Bit if which building usually.
oramirez2,Logro_0_people,2024-09-11,Lose high some contain position seem.
oramirez2,Logro_1_behavior,2024-03-15,Cut debate language artist attorney fill return college.
oramirez2,Logro_2_reflect,2024-09-06,By word close including could.
jessicaanderson3,Logro_0_fly,2024-08-03,Rather offer town for of open.
jessicaanderson3,Logro_1_reason,2024-08-12,President just soldier today former court prevent.
jessicaanderson3,Logro_2_and,2024-08-06,Go fall number.
brent294,Logro_0_site,2024-09-07,Leader list similar finally college.
brent294,Logro_1_piece,2024-05-25,Law painting understand ago.
brent294,Logro_2_owner,2024-01-17,Service use single knowledge page day.
lsanders5,Logro_0_believe,2024-01-27,Budget learn message establish outside.
lsanders5,Logro_1_science,2024-11-16,Writer yes author great worker material foot.
lsanders5,Logro_2_certain,2024-04-26,I former little reach bed people.
rogersjoshua6,Logro_0_charge,2024-04-26,Customer face open power early term.
rogersjoshua6,Logro_1_itself,2024-10-01,Land relate public people miss.
rogersjoshua6,Logro_2_particularly,2024-06-24,Season campaign small stage necessary.
jennifer907,Logro_0_hope,2024-03-17,Smile general only know from almost.
jennifer907,Logro_1_last,2024-05-14,Place respond back town form.
jennifer907,Logro_2_raise,2024-05-20,Factor consider standard early strong.
gthompson8,Logro_0_child,2024-06-24,Long seven keep television foreign teacher.
gthompson8,Logro_1_beyond,2024-09-12,Attorney either shake story.
gthompson8,Logro_2_girl,2024-09-26,Threat war child fear.
williamsryan9,Logro_0_for,2024-01-09,West see but air different wind song.
williamsryan9,Logro_1_work,2024-01-22,Stuff continue government.
williamsryan9,Logro_2_sport,2024-10-22,Last student visit wait too.
moorechristopher10,Logro_0_example,2024-09-25,Eight organization teach close interesting sister.
moorechristopher10,Logro_1_material,2024-05-02,Care community play group major.
moorechristopher10,Logro_2_sign,2024-10-26,Window prove debate near response plan.
katrinaadams11,Logro_0_music,2023-12-30,Future our thank conference compare laugh.
katrinaadams11,Logro_1_look,2024-07-14,Eat focus lot stay season step stop.
katrinaadams11,Logro_2_fill,2024-06-01,Whom participant mission man.
guerrerosteven12,Logro_0_son,2024-04-07,Second exactly president apply unit how big.
guerrerosteven12,Logro_1_join,2024-03-18,Leave above with reason and for tell.
guerrerosteven12,Logro_2_food,2024-02-18,Thought media tough best trial.
daniel6313,Logro_0_until,2024-04-15,Learn and magazine inside.
daniel6313,Logro_1_skin,2023-12-20,Free catch seem.
daniel6313,Logro_2_arm,2024-11-20,Even treat summer group.
gtaylor14,Logro_0_parent,2024-06-28,Position similar leave large pattern.
gtaylor14,Logro_1_other,2024-06-23,Occur few any series arrive police throw remain.
gtaylor14,Logro_2_meet,2024-04-06,Perform whole lot idea.
lharris15,Logro_0_none,2024-02-14,Fish hair bad national finally.
lharris15,Logro_1_whether,2023-12-21,Country image strategy nice professor television last hotel.
lharris15,Logro_2_sister,2024-04-25,Radio billion picture because beat believe.
vjensen16,Logro_0_between,2024-04-29,Mind reason future key increase property campaign job.
vjensen16,Logro_1_generation,2024-06-09,Ever throw treatment father director win.
vjensen16,Logro_2_hit,2024-05-29,Participant off north nor building raise.
mullinswyatt17,Logro_0_necessary,2024-06-03,Address oil develop cover.
mullinswyatt17,Logro_1_option,2024-08-20,Join cultural ability election buy.
mullinswyatt17,Logro_2_beautiful,2024-01-26,Air set reduce safe.
burnetteric18,Logro_0_dark,2023-11-29,Question board boy take return at exactly.
burnetteric18,Logro_1_response,2024-10-31,What student moment rate feel state agree.
burnetteric18,Logro_2_approach,2024-10-24,Interview leg however president beat save view.
cody7919,Logro_0_ever,2024-08-14,Energy growth result.
cody7919,Logro_1_democratic,2024-02-22,Fall son future simple thus.
cody7919,Logro_2_new,2024-07-21,Begin explain gas discussion office purpose watch.
thoover20,Logro_0_coach,2024-03-25,Go way until measure quickly event.
thoover20,Logro_1_increase,2024-02-10,Movement career international scientist how attorney.
thoover20,Logro_2_huge,2024-03-28,Report thought as daughter.
ncampbell21,Logro_0_like,2024-11-03,High that thousand major sign feel process.
ncampbell21,Logro_1_free,2024-05-26,Cause final use.
ncampbell21,Logro_2_just,2024-07-14,Environmental police cup bar impact building second.
steven6422,Logro_0_book,2024-05-21,Have pattern couple throw.
steven6422,Logro_1_open,2024-10-14,Recognize only loss hard trouble relate meeting.
steven6422,Logro_2_too,2024-05-05,Through risk radio economic on consumer.
ogates23,Logro_0_program,2023-12-20,Sit nor cause seek nor.
ogates23,Logro_1_tend,2023-12-10,Could for PM station put shake call action.
ogates23,Logro_2_source,2024-05-06,Before level different interview.
websterjessica24,Logro_0_finish,2024-09-24,Factor safe away seem second realize detail.
websterjessica24,Logro_1_toward,2024-10-18,Herself enjoy rise car medical rest involve.
websterjessica24,Logro_2_today,2023-12-25,Ground ever school result chair environment age.
edward4825,Logro_0_buy,2024-06-25,Husband cup course whose kid field.
edward4825,Logro_1_visit,2024-01-26,Economy scientist respond drive billion customer.
edward4825,Logro_2_growth,2024-10-01,Question PM under crime.
vincent3726,Logro_0_technology,2024-06-23,Receive next focus attorney degree action.
vincent3726,Logro_1_parent,2024-04-28,Option individual fish past.
vincent3726,Logro_2_meeting,2024-06-21,Plan design cover husband task nice.
kayla7827,Logro_0_to,2024-08-06,Value color stop.
kayla7827,Logro_1_magazine,2024-11-16,Great long wrong necessary computer inside.
kayla7827,Logro_2_among,2024-08-30,Prevent away wonder yet summer.
bobby6628,Logro_0_term,2024-02-15,Series book agree will set.
bobby6628,Logro_1_serious,2024-01-26,With available western room.
bobby6628,Logro_2_artist,2023-11-24,Himself feel thousand answer.
amymcdonald29,Logro_0_product,2024-07-31,Nice analysis church fire TV crime true.
amymcdonald29,Logro_1_small,2024-07-02,Several today environmental full deal today capital.
amymcdonald29,Logro_2_factor,2024-08-24,Believe truth nothing financial.
samantha6330,Logro_0_dinner,2024-03-08,Stage ability next among try tend also.
samantha6330,Logro_1_ever,2024-07-05,Manager appear success by big arrive.
samantha6330,Logro_2_air,2024-09-07,Risk lead although play serious car.
william7831,Logro_0_them,2024-02-18,Discussion suddenly choose thousand.
william7831,Logro_1_yet,2024-04-05,Rise news want.
william7831,Logro_2_gun,2023-11-25,Follow around that unit feeling account next.
nicholasjones32,Logro_0_cause,2024-08-18,Without here item under system must old.
nicholasjones32,Logro_1_use,2024-02-15,Expert since evidence join wait game recognize practice.
nicholasjones32,Logro_2_near,2024-03-06,Enough serve science type.
milesdiane33,Logro_0_knowledge,2024-02-23,Church create movie we since.
milesdiane33,Logro_1_operation,2024-07-01,Candidate until three budget.
milesdiane33,Logro_2_real,2024-05-10,Thousand respond probably can soon of wall.
ramirezchristine34,Logro_0_next,2024-06-11,Economic eye over past which what follow.
ramirezchristine34,Logro_1_town,2024-03-03,Industry management tough manager offer speech education development.
ramirezchristine34,Logro_2_mission,2024-01-23,Though they eight image population arrive yourself record.
garciabenjamin35,Logro_0_break,2024-04-11,Public mention ball young really pattern Mr.
garciabenjamin35,Logro_1_woman,2024-03-06,Low seek those play ball many.
garciabenjamin35,Logro_2_onto,2024-10-19,Top save focus six surface.
brian2336,Logro_0_help,2024-10-31,Bar election dream couple.
brian2336,Logro_1_newspaper,2023-12-14,Whose range daughter environmental fast exist computer.
brian2336,Logro_2_paper,2024-06-10,Best government expect social.
ericcochran37,Logro_0_responsibility,2023-12-07,As wide find make.
ericcochran37,Logro_1_per,2024-11-13,Just town act apply long century.
ericcochran37,Logro_2_service,2024-10-17,Character provide improve their lay.
kim1338,Logro_0_father,2024-08-23,Sing production player from however.
kim1338,Logro_1_let,2024-04-16,Minute purpose success employee within town.
kim1338,Logro_2_would,2024-06-27,Animal seem list feel affect movie claim agreement.
walter9839,Logro_0_response,2023-12-10,Radio be child outside business this.
walter9839,Logro_1_lose,2024-07-21,Election operation against.
walter9839,Logro_2_inside,2024-08-27,According school candidate building can court offer.
bwagner40,Logro_0_expect,2023-12-16,Eye information form once.
bwagner40,Logro_1_discuss,2024-11-15,Want several administration machine four most.
bwagner40,Logro_2_national,2024-01-17,Another behavior range expect.
halljames41,Logro_0_region,2024-08-02,Herself care campaign.
halljames41,Logro_1_identify,2024-04-17,To home PM leg because attention toward.
halljames41,Logro_2_herself,2024-07-09,Training fill treatment although people open participant site.
victoriaadams42,Logro_0_wife,2024-07-27,Development cell base capital any.
victoriaadams42,Logro_1_back,2024-01-10,Kitchen carry body another.
victoriaadams42,Logro_2_drive,2024-10-18,Heavy change focus there.
davidcollier43,Logro_0_behind,2024-08-08,However Republican country pattern show become including garden.
davidcollier43,Logro_1_current,2024-08-22,Each citizen well however computer field computer.
davidcollier43,Logro_2_little,2024-01-10,Soldier really meet wall join language glass.
john5644,Logro_0_town,2024-08-19,About civil born staff home control product.
john5644,Logro_1_indicate,2023-12-18,Last could mean your.
john5644,Logro_2_account,2024-08-04,Pattern image explain figure group radio.
reginaanderson45,Logro_0_particularly,2024-11-14,Agree drug write better wide.
reginaanderson45,Logro_1_treat,2024-05-27,Always message would floor.
reginaanderson45,Logro_2_wear,2024-03-24,Sea too sister environmental.
jaustin46,Logro_0_TV,2024-01-02,It site eat place push front thought when.
jaustin46,Logro_1_success,2024-06-30,Cup produce blue provide player.
jaustin46,Logro_2_discuss,2024-07-06,Often toward among computer early protect.
harriscarrie47,Logro_0_recent,2024-11-12,Interesting wife alone all attention bar sometimes.
harriscarrie47,Logro_1_door,2024-11-13,Others worker study allow hundred trouble.
harriscarrie47,Logro_2_money,2024-01-06,Than else baby air rest soldier.
joshua1448,Logro_0_information,2023-12-27,Final personal need experience production chance.
joshua1448,Logro_1_yet,2024-05-28,Wife form successful rule study mother.
joshua1448,Logro_2_strong,2024-11-07,Subject every teacher money believe.
christopher5349,Logro_0_list,2024-07-03,Number character evidence probably with reason art stuff.
christopher5349,Logro_1_computer,2024-06-09,Raise hit race.
christopher5349,Logro_2_hotel,2024-06-25,Prepare message find from hold data friend.
htapia50,Logro_0_economy,2024-07-02,Democrat memory wife large those call executive several.
htapia50,Logro_1_step,2024-03-29,Break able resource budget ahead.
htapia50,Logro_2_find,2023-11-28,Morning the factor most course.
ashley0651,Logro_0_third,2024-05-27,Appear yard music their you.
ashley0651,Logro_1_memory,2024-03-20,Serious section care method daughter fish.
ashley0651,Logro_2_onto,2023-12-04,Night small marriage suffer oil.
gabrielavillarreal52,Logro_0_young,2024-02-06,Age current player.
gabrielavillarreal52,Logro_1_late,2024-08-18,That say western soon fire.
gabrielavillarreal52,Logro_2_positive,2024-01-29,Role director maintain apply moment.
smithjuan53,Logro_0_anyone,2024-05-28,Entire discussion meet themselves most.
smithjuan53,Logro_1_career,2023-12-15,Should listen hotel understand market.
smithjuan53,Logro_2_chance,2024-09-12,Read whom hit.
stephanieflores54,Logro_0_improve,2024-02-28,Conference whom job those.
stephanieflores54,Logro_1_necessary,2024-01-15,Himself your material certainly our well.
stephanieflores54,Logro_2_identify,2024-08-11,Mean offer fact court say recently.
virginia7655,Logro_0_commercial,2024-11-11,Sometimes talk foreign service however game.
virginia7655,Logro_1_sit,2024-03-19,Wish recently take need reason news hundred.
virginia7655,Logro_2_whatever,2024-03-21,Million else page hold white member.
kpratt56,Logro_0_affect,2024-10-01,Take sound Congress condition environmental.
kpratt56,Logro_1_huge,2024-01-10,Language ability TV.
kpratt56,Logro_2_into,2024-03-11,Pick economy rate ball.
nancy7857,Logro_0_black,2024-03-10,Specific may home skin.
nancy7857,Logro_1_few,2024-11-03,Manager method everything score draw present probably.
nancy7857,Logro_2_its,2024-06-15,Choice risk in newspaper official news.
tammiebuck58,Logro_0_American,2024-06-01,Write tell show street lay place unit.
tammiebuck58,Logro_1_message,2024-07-02,Cup everyone main decision major.
tammiebuck58,Logro_2_section,2024-03-03,Next no opportunity state image base school.
gkrause59,Logro_0_with,2024-07-07,Medical common customer very bag.
gkrause59,Logro_1_general,2024-10-25,Moment but well future another fish yes.
gkrause59,Logro_2_paper,2024-01-22,Today government wall like form.
willie4660,Logro_0_process,2023-12-30,Member trade friend.
willie4660,Logro_1_method,2024-08-29,Group education reflect good bring.
willie4660,Logro_2_that,2024-02-08,Provide approach know bill movement each.
ebony8261,Logro_0_think,2024-02-14,If store word arrive entire.
ebony8261,Logro_1_perform,2024-05-03,Listen throw continue walk provide right.
ebony8261,Logro_2_ok,2024-09-22,Pull executive three past add.
ddiaz62,Logro_0_raise,2024-09-25,Message notice risk sure major yard green.
ddiaz62,Logro_1_thousand,2024-03-16,Money energy quite artist.
ddiaz62,Logro_2_cell,2024-11-12,Child whole character hear.
april9363,Logro_0_specific,2024-09-19,Off wind site fly side be best.
april9363,Logro_1_behavior,2023-12-18,Recognize positive speak occur.
april9363,Logro_2_then,2024-05-25,Thus range lead change discuss describe southern.
brian8464,Logro_0_newspaper,2023-12-28,Table letter cell wonder police your seat determine.
brian8464,Logro_1_interest,2024-10-21,Action enjoy American responsibility make appear.
brian8464,Logro_2_moment,2024-07-11,Middle network lay TV century American national.
ytaylor65,Logro_0_animal,2023-11-22,College gun type way realize example.
ytaylor65,Logro_1_rise,2023-12-19,Democrat large beyond energy pressure attorney little turn.
ytaylor65,Logro_2_side,2024-06-25,Mean hard window feel save election.
gsummers66,Logro_0_college,2024-02-21,Five state hear pick.
gsummers66,Logro_1_party,2024-06-05,Research develop foreign here cut.
gsummers66,Logro_2_appear,2024-07-15,Politics word attack face leave can.
uarroyo67,Logro_0_yeah,2024-08-16,We board cold whose about.
uarroyo67,Logro_1_federal,2024-04-29,School teach stand audience.
uarroyo67,Logro_2_available,2024-03-14,Radio prepare husband fact sound field.
xkennedy68,Logro_0_major,2023-11-24,That soldier pretty stay safe above.
xkennedy68,Logro_1_cost,2024-06-08,Wind chair some wait painting spring while couple.
xkennedy68,Logro_2_many,2024-10-06,Official task step two color mission.
pgiles69,Logro_0_push,2024-01-02,Join population major strategy book election.
pgiles69,Logro_1_level,2024-05-06,Action possible page great risk cost.
pgiles69,Logro_2_third,2023-11-28,Find both write.
oliverrachael70,Logro_0_political,2023-11-27,Senior some return degree.
oliverrachael70,Logro_1_already,2023-12-29,Part man hope hit.
oliverrachael70,Logro_2_home,2024-10-10,Feel eat chair.
hamiltonjoel71,Logro_0_onto,2024-09-28,Show subject trouble inside spring on test.
hamiltonjoel71,Logro_1_number,2024-09-26,Worker peace difference memory start century food candidate.
hamiltonjoel71,Logro_2_part,2024-01-26,When now soon page.
connieswanson72,Logro_0_future,2024-06-13,End serve last size certain style.
connieswanson72,Logro_1_series,2024-03-18,Pretty shoulder art road.
connieswanson72,Logro_2_between,2023-12-05,President stuff road environmental outside.
rogersstephanie73,Logro_0_magazine,2024-05-03,Others financial six career whose and.
rogersstephanie73,Logro_1_eight,2024-11-10,Magazine practice human.
rogersstephanie73,Logro_2_material,2024-03-24,Question gas environment.
evelynwhitney74,Logro_0_cut,2024-07-25,Thus conference bank area pay.
evelynwhitney74,Logro_1_continue,2024-01-14,Much individual glass note executive sing light.
evelynwhitney74,Logro_2_according,2024-10-30,Any more partner involve.
harristaylor75,Logro_0_traditional,2024-06-18,About either together artist within already nation.
harristaylor75,Logro_1_performance,2023-12-16,Drive song election ball.
harristaylor75,Logro_2_address,2024-06-16,Recognize section another how friend lose.
melissaperez76,Logro_0_close,2024-11-16,Despite necessary Mr director return memory need.
melissaperez76,Logro_1_top,2024-08-16,Phone get game every officer exist.
melissaperez76,Logro_2_add,2023-12-18,Reveal plan possible understand difficult four.
cprice77,Logro_0_health,2024-05-10,Speech away much inside.
cprice77,Logro_1_town,2024-01-03,Only guess market chance.
cprice77,Logro_2_firm,2024-01-14,Begin writer season recognize end.
ginamckenzie78,Logro_0_daughter,2024-01-31,Fear arm type kitchen tough national.
ginamckenzie78,Logro_1_organization,2024-07-19,Turn model realize specific.
ginamckenzie78,Logro_2_chair,2024-10-02,People different growth relate can under.
coxbradley79,Logro_0_section,2024-09-05,Phone with light.
coxbradley79,Logro_1_far,2024-06-08,Maintain lose over later be mouth country.
coxbradley79,Logro_2_end,2024-06-28,Reflect already eight these owner just choose.
pamela5580,Logro_0_around,2024-10-19,Edge nothing candidate lawyer purpose day.
pamela5580,Logro_1_leave,2024-06-26,Worker sea yourself but page finally.
pamela5580,Logro_2_raise,2023-12-10,Design last major.
johnsonwilliam81,Logro_0_there,2024-09-10,Anything magazine surface.
johnsonwilliam81,Logro_1_evidence,2024-08-20,Probably page conference.
johnsonwilliam81,Logro_2_listen,2024-03-06,Two address single often.
shawn7182,Logro_0_early,2024-04-26,However in agreement dinner check.
shawn7182,Logro_1_yes,2023-12-28,Across under wall hope red up since.
shawn7182,Logro_2_situation,2024-01-13,Police special reveal plan lose.
ismith83,Logro_0_capital,2024-10-16,Carry necessary will.
ismith83,Logro_1_trial,2024-06-13,Activity likely herself general central.
ismith83,Logro_2_real,2024-04-16,Wish wear unit total return together grow center.
robert9484,Logro_0_interview,2024-05-15,Fire this door.
robert9484,Logro_1_truth,2024-06-18,Story family sometimes bank world.
robert9484,Logro_2_pass,2024-07-31,At soon quite court.
jordan7685,Logro_0_project,2024-03-20,Others spend thought stage blue song.
jordan7685,Logro_1_politics,2024-09-20,Job understand house argue plan and operation.
jordan7685,Logro_2_job,2024-01-24,We next piece beyond next stock.
belldonald86,Logro_0_million,2024-04-24,Lay prepare politics several condition time morning.
belldonald86,Logro_1_event,2024-09-15,Itself population push service center not.
belldonald86,Logro_2_cost,2024-05-07,Article any teach fish.
cindygreen87,Logro_0_benefit,2024-03-06,Tv account commercial.
cindygreen87,Logro_1_during,2024-09-26,Hour population recent.
cindygreen87,Logro_2_watch,2024-06-10,Economic avoid sign someone.
gwebb88,Logro_0_serve,2024-03-07,Couple whatever ability democratic.
gwebb88,Logro_1_music,2024-02-18,Look range ago young west.
gwebb88,Logro_2_sound,2024-03-08,Sure parent institution.
dcantrell89,Logro_0_chair,2024-05-20,Feel think clear experience gas exactly left participant.
dcantrell89,Logro_1_investment,2024-05-27,Own think specific office sign.
dcantrell89,Logro_2_economy,2024-03-21,Could music change run.
helliott90,Logro_0_quality,2024-01-19,Experience health officer house.
helliott90,Logro_1_nature,2024-10-26,Somebody table everything prevent term us stage less.
helliott90,Logro_2_authority,2024-02-18,Century blue material leader pick.
amanda9091,Logro_0_require,2024-09-29,Break bag space party season woman.
amanda9091,Logro_1_hour,2024-04-13,East with these certainly citizen.
amanda9091,Logro_2_officer,2024-07-13,Truth concern rock believe financial stuff.
jessicaburton92,Logro_0_through,2024-03-14,Indicate try it human couple establish.
jessicaburton92,Logro_1_attention,2024-09-30,Want instead individual American surface.
jessicaburton92,Logro_2_computer,2024-02-03,On story too if enough.
inolan93,Logro_0_month,2024-01-21,Lot system rich standard cell friend.
inolan93,Logro_1_subject,2024-04-27,Stage benefit article direction third.
inolan93,Logro_2_score,2023-12-23,Take have power claim.
barnesronald94,Logro_0_remain,2024-04-14,Suddenly left paper information stage politics single attention.
barnesronald94,Logro_1_decision,2024-05-21,Yourself trip human church partner turn stage.
barnesronald94,Logro_2_else,2024-02-04,Machine send opportunity their occur example remain.
nataliereyes95,Logro_0_so,2024-09-27,Less listen miss color heavy feeling sing.
nataliereyes95,Logro_1_the,2024-08-10,Program bring go prevent very place race.
nataliereyes95,Logro_2_let,2024-02-26,Training important husband yard join.
gluna96,Logro_0_hit,2024-02-12,Hold current between coach total any ago.
gluna96,Logro_1_mission,2024-07-31,Into early young indeed whom key.
gluna96,Logro_2_open,2024-03-13,Quite skill international system.
tcole97,Logro_0_nor,2024-10-16,Chance stuff at newspaper opportunity skin about simply.
tcole97,Logro_1_live,2024-06-19,Short produce himself and.
tcole97,Logro_2_industry,2024-02-21,Culture wonder baby.
robertallen98,Logro_0_worry,2024-02-11,Allow participant trouble pick wait leg.
robertallen98,Logro_1_too,2023-12-22,Finally enjoy safe threat cut.
robertallen98,Logro_2_think,2024-11-07,Make machine several during another discussion sit newspaper.
livingstonalyssa99,Logro_0_difficult,2023-11-22,Pm central kid yourself as institution.
livingstonalyssa99,Logro_1_environment,2024-02-28,Act use increase.
livingstonalyssa99,Logro_2_politics,2024-09-22,Several trouble production use know left.
smithsara100,Logro_0_wear,2024-10-01,Kid system walk increase unit little.
smithsara100,Logro_1_similar,2024-11-10,Network different Mr TV low lay activity pull.
smithsara100,Logro_2_budget,2024-02-09,Ask by television dream side right.
jeremy56101,Logro_0_condition,2024-11-12,Detail door indicate knowledge head appear.
jeremy56101,Logro_1_sea,2024-01-02,North message charge force still along around.
jeremy56101,Logro_2_last,2024-09-08,International theory both write better born enter avoid.
crystaltorres102,Logro_0_low,2023-12-11,Bed because over poor.
crystaltorres102,Logro_1_very,2024-08-05,Final though activity feeling animal human.
crystaltorres102,Logro_2_fund,2024-11-01,Discussion strong thus than just who if.
cduarte103,Logro_0_area,2024-10-03,Keep change deep off.
cduarte103,Logro_1_ago,2023-11-30,Fight smile at job health hotel our.
cduarte103,Logro_2_approach,2024-02-22,Player poor window writer number future manager toward.
esosa104,Logro_0_tax,2024-05-24,Adult mind eat event daughter treatment development level.
esosa104,Logro_1_high,2024-06-29,Upon feeling will minute situation.
esosa104,Logro_2_prove,2024-08-02,Player according behind area change.
kristin10105,Logro_0_fish,2024-05-15,Building rule much brother black tax theory.
kristin10105,Logro_1_number,2024-08-22,Anything member these affect themselves role.
kristin10105,Logro_2_cause,2024-04-12,Education contain area everybody.
paigele106,Logro_0_Republican,2024-02-04,Doctor explain out church bill must clear whatever.
paigele106,Logro_1_indeed,2023-11-28,Loss just above ball feeling.
paigele106,Logro_2_wonder,2024-09-07,Decide forget mouth within return than.
harriserin107,Logro_0_however,2024-06-02,Rather room across production whole.
harriserin107,Logro_1_student,2024-09-04,Challenge analysis financial what.
harriserin107,Logro_2_hospital,2024-03-07,Believe current memory onto challenge still.
becky96108,Logro_0_risk,2024-06-19,Democratic production cost about note resource office sort.
becky96108,Logro_1_election,2024-04-08,Service purpose draw site citizen Democrat.
becky96108,Logro_2_sure,2024-02-10,Eye production challenge next.
steven41109,Logro_0_agency,2024-07-26,Actually central choose people under where sound.
steven41109,Logro_1_class,2024-09-05,Quite this cup prevent.
steven41109,Logro_2_billion,2024-03-19,Here service organization city.
lisamckenzie110,Logro_0_economy,2024-04-24,Hair fast stage any themselves laugh general.
lisamckenzie110,Logro_1_notice,2023-12-23,Play various evidence turn administration.
lisamckenzie110,Logro_2_able,2024-09-16,Item lot section ago beat evidence ball.
wreynolds111,Logro_0_fine,2024-06-27,Sing effort early mind smile risk necessary.
wreynolds111,Logro_1_course,2024-04-22,Water economy enter thousand worker.
wreynolds111,Logro_2_represent,2024-02-15,Support rise now force ever yard economy.
stewartjose112,Logro_0_reveal,2024-03-31,Marriage window alone wide always late unit white.
stewartjose112,Logro_1_world,2023-12-08,Red nature throughout not.
stewartjose112,Logro_2_happy,2024-09-24,Realize best quickly visit have.
bwhite113,Logro_0_box,2024-05-13,Week public term her lose stay nature.
bwhite113,Logro_1_myself,2024-01-02,He tough assume mention.
bwhite113,Logro_2_main,2024-09-27,Forward she lead carry its hair.
hvalencia114,Logro_0_life,2024-04-07,North military kid history reality class learn town.
