J_Nombre,nombre,fecha_de_adquisicion,descripcion
jillianrobinson681,Logro_0_hold,2024-01-20,Experience soon friend north.
jillianrobinson681,Logro_1_Mr,2024-08-08,Listen wrong by break.
jillianrobinson681,Logro_2_sit,2024-11-03,Matter character whole early throw key community its.
morgan17682,Logro_0_possible,2024-07-04,Could morning policy clearly sit yet recent pretty.
morgan17682,Logro_1_season,2024-06-29,Three identify year course store consumer international.
morgan17682,Logro_2_bring,2024-02-25,Value age network agent politics up run.
ramirezjames683,Logro_0_billion,2024-06-08,Generation whole go spend face back.
ramirezjames683,Logro_1_environmental,2024-01-22,Everybody actually meet.
ramirezjames683,Logro_2_four,2024-05-02,Skin computer identify.
sandra14684,Logro_0_fight,2024-07-26,Interest audience tree shoulder black.
sandra14684,Logro_1_our,2024-01-13,Contain instead thus.
sandra14684,Logro_2_lay,2023-12-02,Red step small at.
lbooker685,Logro_0_all,2024-04-13,Summer pick decision support writer around drive.
lbooker685,Logro_1_he,2024-08-17,Similar loss food job reduce between energy.
lbooker685,Logro_2_fall,2024-04-10,Girl speak history guy rise win.
jeremy81686,Logro_0_music,2024-01-28,Radio number system bit soldier off address.
jeremy81686,Logro_1_page,2024-07-02,Necessary watch degree audience however.
jeremy81686,Logro_2_former,2024-10-28,Table speech though market item yes difference expect.
djones687,Logro_0_remain,2024-10-06,East evening country father say force alone.
djones687,Logro_1_court,2024-02-05,Money some wall wonder wrong me.
djones687,Logro_2_develop,2024-06-26,Never particularly be couple no best.
scott33688,Logro_0_machine,2024-08-05,Shake head admit hair use together.
scott33688,Logro_1_light,2024-08-05,East any thing point.
scott33688,Logro_2_return,2024-09-27,Safe necessary hard for away.
floydmark689,Logro_0_mean,2024-03-31,Get each arm read.
floydmark689,Logro_1_program,2024-05-05,Doctor although kid trip.
floydmark689,Logro_2_likely,2024-03-22,Manager next structure design let man.
judith18690,Logro_0_success,2024-05-01,Short decision hold.
judith18690,Logro_1_himself,2024-10-21,Student teacher remain fly author.
judith18690,Logro_2_front,2024-03-05,Recently newspaper ground serve page.
scott22691,Logro_0_sister,2024-09-07,Available service board entire sing it behind space.
scott22691,Logro_1_participant,2023-12-04,Couple accept or rock game just or.
scott22691,Logro_2_matter,2024-10-11,To room hope whether.
alexbender692,Logro_0_song,2024-06-27,Figure art car behind sound scientist institution.
alexbender692,Logro_1_group,2024-09-06,Inside east remember page author school.
alexbender692,Logro_2_she,2024-09-30,Decision less give audience thousand.
david95693,Logro_0_among,2024-03-24,Carry leg role fall cost.
david95693,Logro_1_country,2024-08-12,Answer ago stage hope.
david95693,Logro_2_experience,2024-01-01,Five while always themselves enough toward.
maldonadomichelle694,Logro_0_evening,2024-05-19,Maintain measure tonight finish.
maldonadomichelle694,Logro_1_simple,2024-07-15,Week travel opportunity team whom pretty already up.
maldonadomichelle694,Logro_2_way,2024-10-23,Go market concern nearly drive.
michelle74695,Logro_0_thank,2024-05-09,Quite several work material trade.
michelle74695,Logro_1_beat,2024-02-19,Friend box it she catch either business.
michelle74695,Logro_2_day,2024-04-15,Black report argue listen it PM.
dana68696,Logro_0_send,2024-06-04,After long order provide message someone site today.
dana68696,Logro_1_phone,2023-12-31,Nothing garden operation issue young interest method.
dana68696,Logro_2_foot,2024-05-29,Suffer of president between.
hhall697,Logro_0_mouth,2023-12-23,Watch add street religious into none.
hhall697,Logro_1_million,2024-09-02,Friend decide sort feel practice again.
hhall697,Logro_2_character,2024-08-08,American court choose stock live knowledge game.
williamcaldwell698,Logro_0_deep,2024-05-19,Lose teach near eight fine power history.
williamcaldwell698,Logro_1_we,2024-05-11,Hard make project type same I.
williamcaldwell698,Logro_2_what,2024-09-19,Certain analysis billion win his word stay.
dfischer699,Logro_0_government,2024-07-21,Natural fish notice compare may should.
dfischer699,Logro_1_necessary,2024-01-01,Government true tell early dream suffer team.
dfischer699,Logro_2_level,2024-09-06,Authority tonight like audience tree smile threat.
jgalloway700,Logro_0_available,2024-04-24,Bag stand music we.
jgalloway700,Logro_1_more,2024-04-05,Because never house walk nature provide list.
jgalloway700,Logro_2_likely,2024-11-16,Real weight citizen serve civil improve serve.
bushtravis701,Logro_0_certain,2024-10-16,Prevent table show culture always level.
bushtravis701,Logro_1_base,2024-07-16,Rock year would later specific.
bushtravis701,Logro_2_keep,2023-12-20,Rather detail suddenly beautiful little fish.
bradylisa702,Logro_0_while,2024-05-29,Under usually third.
bradylisa702,Logro_1_green,2024-08-24,Fight often energy near.
bradylisa702,Logro_2_enjoy,2024-01-26,Though guess study store.
john02703,Logro_0_something,2024-08-08,Answer similar machine Democrat like mother professor.
john02703,Logro_1_forget,2023-12-07,Amount discussion why fly seven.
john02703,Logro_2_look,2024-03-29,Question difficult become citizen another.
annjones704,Logro_0_baby,2024-06-24,Bag live meeting.
annjones704,Logro_1_return,2024-03-28,Election adult morning lawyer of.
annjones704,Logro_2_government,2024-08-12,Increase try station important recently future.
brownrebecca705,Logro_0_my,2024-05-19,Show study early fall conference.
brownrebecca705,Logro_1_box,2024-03-05,Bag impact young operation control painting.
brownrebecca705,Logro_2_seem,2024-11-17,Property tax discuss.
jane40706,Logro_0_hard,2024-07-06,Serious suffer between.
jane40706,Logro_1_us,2024-03-14,Event lead west garden where.
jane40706,Logro_2_fire,2024-09-10,Ready vote answer size group.
dhill707,Logro_0_bill,2024-05-01,Benefit environment win pattern model buy.
dhill707,Logro_1_cold,2023-12-23,Kid true security set.
dhill707,Logro_2_top,2024-01-31,Because involve image huge service technology.
hortonjoshua708,Logro_0_voice,2024-05-19,Car those already relationship want use.
hortonjoshua708,Logro_1_article,2024-09-29,Current side mind who under.
hortonjoshua708,Logro_2_many,2024-03-22,Since size safe him wrong.
blakejohnson709,Logro_0_seek,2024-11-10,Five concern ten near.
blakejohnson709,Logro_1_ready,2024-01-06,President both Congress require must meeting.
blakejohnson709,Logro_2_live,2024-08-30,Mrs young too training all she bring.
sonyarobinson710,Logro_0_chair,2024-07-07,Measure now offer suggest when.
sonyarobinson710,Logro_1_parent,2024-04-16,Better task security week have.
sonyarobinson710,Logro_2_culture,2024-11-16,Explain network guess.
joshuaallen711,Logro_0_decade,2024-03-15,After price direction to second high daughter.
joshuaallen711,Logro_1_it,2024-08-11,Eat campaign travel organization book series go.
joshuaallen711,Logro_2_nature,2024-06-19,Watch trial answer major also process different.
jhurst712,Logro_0_necessary,2024-07-28,What government player idea Mr.
jhurst712,Logro_1_rise,2024-10-11,Tell life nothing event collection house lawyer Congress.
jhurst712,Logro_2_democratic,2023-12-04,Him evidence film trouble paper final father.
garciakeith713,Logro_0_time,2024-05-18,Prevent exactly figure again.
garciakeith713,Logro_1_machine,2024-01-27,Member blood sport car late throughout join.
garciakeith713,Logro_2_decide,2024-11-10,Election theory program expert not.
moralesvanessa714,Logro_0_order,2024-02-16,Project end worker draw month.
moralesvanessa714,Logro_1_audience,2024-11-04,Worry do together get Mr pull.
moralesvanessa714,Logro_2_grow,2024-09-02,Sort or these measure start.
durhamtammy715,Logro_0_resource,2024-07-24,Girl war word better just remember.
durhamtammy715,Logro_1_ground,2023-12-19,Likely democratic east list foreign.
durhamtammy715,Logro_2_my,2024-08-20,Thank even cell difficult leg.
rhenderson716,Logro_0_base,2024-08-08,Two program able difficult student.
rhenderson716,Logro_1_car,2024-02-19,Imagine success time decide teach garden begin.
rhenderson716,Logro_2_address,2024-01-14,Deep often fund across fine.
zchambers717,Logro_0_with,2024-05-29,Space daughter three owner detail.
zchambers717,Logro_1_throw,2024-07-11,Card entire south scene most him popular.
zchambers717,Logro_2_window,2023-11-21,Law bill democratic admit country bag.
jonesglenda718,Logro_0_require,2024-05-18,Same pass as TV throw action end sister.
jonesglenda718,Logro_1_nature,2024-11-11,Manager even treatment friend beyond rich month.
jonesglenda718,Logro_2_firm,2023-12-08,Style speak community difficult.
gamblelarry719,Logro_0_industry,2024-09-30,Send road natural simply citizen of final.
gamblelarry719,Logro_1_tough,2024-08-28,Return believe method boy newspaper receive.
gamblelarry719,Logro_2_interview,2024-05-28,Quality media step.
judith17720,Logro_0_deal,2024-05-12,Spend mean ten friend.
judith17720,Logro_1_physical,2024-06-22,Kind recently dinner stand.
judith17720,Logro_2_degree,2024-11-15,My difficult individual nothing.
hendersondaniel721,Logro_0_hundred,2024-10-19,Drug star push day.
hendersondaniel721,Logro_1_music,2024-04-08,Of popular minute raise.
hendersondaniel721,Logro_2_next,2024-04-05,Continue few attorney compare whether various ten.
rodgersmelissa722,Logro_0_enough,2024-03-10,Investment just need project red.
rodgersmelissa722,Logro_1_of,2024-09-22,Environment head debate real maybe reality.
rodgersmelissa722,Logro_2_attack,2024-04-19,Choice picture everyone create successful.
aodonnell723,Logro_0_catch,2024-02-12,Among nearly land few single.
aodonnell723,Logro_1_former,2024-11-18,Pretty north open life turn.
aodonnell723,Logro_2_way,2024-05-27,Always media decade away Democrat participant chair.
morriskelly724,Logro_0_employee,2024-10-22,Site him turn now some.
morriskelly724,Logro_1_form,2024-05-31,Minute this history market something.
morriskelly724,Logro_2_box,2024-08-31,Quickly happen meeting trouble financial serious.
janet03725,Logro_0_listen,2024-05-08,Have watch bit television.
janet03725,Logro_1_science,2024-08-26,Police allow individual recently.
janet03725,Logro_2_lot,2024-05-04,Need big heavy whether professional later.
carlsonrandall726,Logro_0_good,2023-11-27,Physical mouth peace indicate.
carlsonrandall726,Logro_1_per,2024-02-08,Many amount type real career result agree.
carlsonrandall726,Logro_2_great,2023-12-07,Member economic production would should set defense compare.
cody80727,Logro_0_husband,2024-06-14,Lay world then.
cody80727,Logro_1_great,2024-06-01,Five leg easy.
cody80727,Logro_2_camera,2024-04-26,Moment reason imagine worker instead.
boyermadeline728,Logro_0_peace,2024-04-29,South face its laugh career determine thus system.
boyermadeline728,Logro_1_door,2024-04-14,Religious hotel condition arrive.
boyermadeline728,Logro_2_such,2024-08-05,Against radio series grow boy.
cynthia87729,Logro_0_fast,2024-01-15,Somebody successful school interview guess appear.
cynthia87729,Logro_1_especially,2024-06-27,Attack your billion operation travel specific discussion.
cynthia87729,Logro_2_cultural,2024-03-03,But employee study drug professional hold design election.
hfernandez730,Logro_0_practice,2024-01-30,Hold heart two thus.
hfernandez730,Logro_1_production,2024-02-12,Other writer society can back behind another.
hfernandez730,Logro_2_official,2024-07-25,Work able peace defense write.
laurenpugh731,Logro_0_when,2024-10-17,Produce food season environment girl actually break within.
laurenpugh731,Logro_1_loss,2024-04-17,Reality first social improve more room.
laurenpugh731,Logro_2_need,2023-12-25,Action keep scientist quality quality look shoulder away.
ashley51732,Logro_0_course,2024-02-08,Both test against.
ashley51732,Logro_1_key,2023-12-16,Artist source laugh although card recognize pay.
ashley51732,Logro_2_today,2024-08-10,Before hundred specific window.
xanderson733,Logro_0_modern,2024-04-20,Whose identify budget floor to fly.
xanderson733,Logro_1_tonight,2024-01-17,Especially industry also.
xanderson733,Logro_2_week,2024-11-02,Pattern bed identify few.
morenomelissa734,Logro_0_perhaps,2024-06-14,Theory movie early central.
morenomelissa734,Logro_1_most,2024-04-16,Site per bed these.
morenomelissa734,Logro_2_rock,2024-10-14,Push camera fact level.
charleswashington735,Logro_0_page,2024-09-23,Your front fish son without eye.
charleswashington735,Logro_1_act,2024-06-10,Story political paper could newspaper.
charleswashington735,Logro_2_difference,2024-04-11,Thought contain entire nature.
mark06736,Logro_0_campaign,2023-12-27,This others too he subject company policy.
mark06736,Logro_1_American,2023-12-02,Into anyone religious system create.
mark06736,Logro_2_conference,2024-06-23,Rate pass lay reason whole total worry.
nnelson737,Logro_0_professor,2024-10-03,Expect law book.
nnelson737,Logro_1_purpose,2023-11-23,Reduce many office north money read during form.
nnelson737,Logro_2_business,2024-05-06,Build white technology tax together choice.
alicia94738,Logro_0_ready,2024-01-03,Also job worry benefit national.
alicia94738,Logro_1_recently,2023-12-08,Drug author first create forget.
alicia94738,Logro_2_Democrat,2023-11-30,Try style across front write.
dianewilliams739,Logro_0_case,2024-11-16,Event bar majority bring for doctor.
dianewilliams739,Logro_1_wait,2024-02-14,Traditional rest sometimes since me forget though.
dianewilliams739,Logro_2_heavy,2024-11-14,Deal together already others degree probably individual.
vkline740,Logro_0_join,2024-06-10,Next shoulder could recently break enjoy.
vkline740,Logro_1_town,2024-01-22,Indeed both so education thing daughter.
vkline740,Logro_2_doctor,2024-09-08,Too them take star trade.
huffmanmichael741,Logro_0_either,2024-03-22,Rise away table partner.
huffmanmichael741,Logro_1_last,2024-03-15,Statement investment ahead site activity type keep.
huffmanmichael741,Logro_2_top,2024-03-05,Rate physical color defense.
nancy90742,Logro_0_nothing,2024-03-17,Assume idea last measure such deep economic.
nancy90742,Logro_1_care,2024-03-30,Fear long trip.
nancy90742,Logro_2_event,2024-01-03,Time decade morning tend success.
nhernandez743,Logro_0_business,2024-04-11,Plan late condition Mr lay too thought.
nhernandez743,Logro_1_standard,2024-01-08,Note kitchen this job.
nhernandez743,Logro_2_authority,2024-01-06,Small very question power behind mission population.
melissa65744,Logro_0_environmental,2024-09-26,Mr business always able.
melissa65744,Logro_1_reason,2024-02-17,Congress she future they.
melissa65744,Logro_2_rise,2024-04-16,Economic quality without stuff want everybody service.
dsantos745,Logro_0_author,2024-01-13,Local interview sort return social.
dsantos745,Logro_1_wear,2024-08-05,Crime table area however manager name.
dsantos745,Logro_2_culture,2024-10-16,Eight police article.
marymartin746,Logro_0_Mrs,2024-03-21,Listen election turn star television participant compare.
marymartin746,Logro_1_ahead,2024-01-01,Probably item meeting from.
marymartin746,Logro_2_another,2024-08-11,Already and wait doctor service.
aguilarstephanie747,Logro_0_something,2024-02-18,Modern citizen reality.
aguilarstephanie747,Logro_1_near,2024-05-17,Especially just memory effect table.
aguilarstephanie747,Logro_2_market,2024-09-06,Do car everybody half goal trial value.
justin25748,Logro_0_far,2024-03-25,Turn own institution than until want.
justin25748,Logro_1_knowledge,2024-07-23,Interview country inside.
justin25748,Logro_2_other,2024-10-01,Finally future agency someone.
wreilly749,Logro_0_true,2024-11-05,Performance someone final.
wreilly749,Logro_1_sort,2024-09-05,Some say show which anything building somebody.
wreilly749,Logro_2_above,2024-01-23,Else dog for training.
sarah61750,Logro_0_walk,2024-05-23,Much baby stage really forget ground sure.
sarah61750,Logro_1_reveal,2024-07-15,Technology four need only movement reflect image level.
sarah61750,Logro_2_level,2024-04-14,Since less others no weight.
olee751,Logro_0_cup,2024-07-16,What international single end wrong sing assume.
olee751,Logro_1_spring,2024-01-28,Thought individual certain future and fact crime.
olee751,Logro_2_art,2024-05-17,Medical paper past leave century realize that sense.
salazarangie752,Logro_0_now,2023-12-10,Pull themselves long ask.
salazarangie752,Logro_1_big,2024-05-05,Situation laugh expert magazine.
salazarangie752,Logro_2_game,2024-05-23,Far yes standard letter plan program.
rhodeslaura753,Logro_0_daughter,2023-11-24,Thought understand imagine worry them history avoid.
rhodeslaura753,Logro_1_everything,2024-04-06,Act reason impact can difference.
rhodeslaura753,Logro_2_save,2024-04-17,System accept democratic maintain.
christopher32754,Logro_0_building,2024-02-09,Consider near woman brother tell level cover contain.
christopher32754,Logro_1_yes,2024-06-03,Home serve write stay month really sing.
christopher32754,Logro_2_whole,2024-07-17,Happen community nation floor conference as.
christinaroberts755,Logro_0_boy,2023-11-21,Organization along effect leader thousand open itself.
christinaroberts755,Logro_1_explain,2023-12-05,Back film economy environmental why.
christinaroberts755,Logro_2_organization,2024-07-01,Moment painting since us campaign media boy.
michael16756,Logro_0_cold,2024-08-22,Television set product physical his.
michael16756,Logro_1_between,2024-10-08,Responsibility company certain seven.
michael16756,Logro_2_walk,2024-05-04,Short heavy dinner field accept table.
morganamanda757,Logro_0_speech,2024-03-14,Rock catch agency recently free improve either.
morganamanda757,Logro_1_quality,2024-04-25,Water walk image national work.
morganamanda757,Logro_2_seek,2024-04-11,Against range rest successful young.
chrisjohnson758,Logro_0_international,2024-10-12,Member analysis improve something.
chrisjohnson758,Logro_1_line,2024-09-29,Million song hair leader boy something.
chrisjohnson758,Logro_2_lay,2024-08-09,Chair clearly collection.
markwatson759,Logro_0_practice,2024-03-02,Until five after benefit.
markwatson759,Logro_1_effect,2024-10-12,Democratic PM different official speech.
markwatson759,Logro_2_operation,2024-04-26,View if memory employee get conference.
kenneth17760,Logro_0_speak,2023-12-18,Several necessary field leave school account.
kenneth17760,Logro_1_painting,2024-10-07,Or how friend ten thing.
kenneth17760,Logro_2_audience,2024-03-15,Brother throughout some suddenly protect.
romangina761,Logro_0_sign,2024-01-06,Big place unit.
romangina761,Logro_1_key,2024-09-16,Across group fine.
romangina761,Logro_2_among,2023-11-30,Risk lawyer spring probably.
tharrington762,Logro_0_health,2024-06-27,For article shoulder cover detail population.
tharrington762,Logro_1_PM,2024-08-26,Home far only Mrs discuss record either.
tharrington762,Logro_2_hospital,2024-08-25,Author rather after.
todd86763,Logro_0_positive,2024-09-12,Be evening line door.
todd86763,Logro_1_how,2023-12-30,Around particularly old see report might.
todd86763,Logro_2_program,2023-12-25,Nor not total shoulder oil southern.
jandrews764,Logro_0_per,2024-07-22,Apply put my realize raise special.
jandrews764,Logro_1_follow,2024-06-02,Executive including girl tough.
jandrews764,Logro_2_defense,2024-03-21,Leave dinner wind institution require decision.
rrivera765,Logro_0_staff,2024-02-13,Picture mention way position traditional alone.
rrivera765,Logro_1_student,2024-07-05,Visit citizen between light on.
rrivera765,Logro_2_go,2024-10-08,Soon open draw.
toddshelley766,Logro_0_red,2024-09-11,Inside south exactly imagine.
toddshelley766,Logro_1_apply,2024-05-30,Think of speech whose.
toddshelley766,Logro_2_director,2024-06-29,Like outside detail little wide.
mcgeedenise767,Logro_0_local,2024-02-13,Say care apply discuss wind.
mcgeedenise767,Logro_1_Democrat,2024-01-05,Represent five class together effort fine process.
mcgeedenise767,Logro_2_range,2024-04-28,Movement yard outside term.
jenniferhughes768,Logro_0_society,2024-09-12,Explain phone old seek.
jenniferhughes768,Logro_1_spring,2024-10-23,House true hospital husband.
jenniferhughes768,Logro_2_old,2024-08-14,Change society star quality.
abigailjones769,Logro_0_over,2023-12-02,Way building information now.
abigailjones769,Logro_1_peace,2024-06-09,Fine blue beat body box.
abigailjones769,Logro_2_staff,2024-11-20,Former story need its tough sit stay quite.
whitneysean770,Logro_0_above,2024-01-13,Follow water rule century also fill environmental.
whitneysean770,Logro_1_trouble,2024-07-29,Term activity drug however international.
whitneysean770,Logro_2_lose,2023-12-17,Agree join team central would purpose pass.
kolsen771,Logro_0_performance,2024-07-17,After effort general south.
kolsen771,Logro_1_idea,2024-07-01,Unit herself on until drive.
kolsen771,Logro_2_ever,2024-06-09,Possible eight color keep population need.
bmiddleton772,Logro_0_gas,2024-10-20,Prove into art represent population.
bmiddleton772,Logro_1_suggest,2024-03-22,Movie drive evidence worry with born.
bmiddleton772,Logro_2_girl,2024-06-19,Page kitchen law outside save member responsibility.
jacob21773,Logro_0_concern,2024-02-27,During our dream represent.
jacob21773,Logro_1_watch,2024-10-06,Event across risk defense.
jacob21773,Logro_2_protect,2024-01-06,Appear identify pick low indicate city.
martinezgrant774,Logro_0_to,2023-12-20,Series recently partner right condition.
martinezgrant774,Logro_1_black,2024-11-15,Either open strategy.
martinezgrant774,Logro_2_tonight,2024-01-05,American play animal magazine middle way dream drug.
jennifer13775,Logro_0_down,2024-07-30,Real indicate herself house fill property begin.
jennifer13775,Logro_1_right,2024-02-09,Total start drug one fact yet so.
jennifer13775,Logro_2_system,2024-07-25,Back not of major head box.
rfranklin776,Logro_0_miss,2023-12-09,Up current meeting identify among daughter animal.
rfranklin776,Logro_1_simply,2024-08-08,Leave large different professor shake space religious.
rfranklin776,Logro_2_everyone,2024-01-06,Lay issue buy form.
cynthia41777,Logro_0_happy,2024-06-30,Both approach room message raise vote.
cynthia41777,Logro_1_statement,2024-02-23,Civil professional consider TV.
cynthia41777,Logro_2_too,2024-10-30,Type which professor impact we prove history.
kellerjill778,Logro_0_him,2024-02-23,Benefit attention body alone final wonder be.
kellerjill778,Logro_1_mention,2024-08-15,Military level any final worker play everyone.
kellerjill778,Logro_2_early,2024-06-28,Forget notice language send increase surface rich.
tbrady779,Logro_0_plant,2024-10-18,Number name star much teacher present college wrong.
tbrady779,Logro_1_continue,2024-05-31,During poor choose will.
tbrady779,Logro_2_main,2024-07-23,Take next there part house food.
richardrodriguez780,Logro_0_though,2024-06-13,Blue parent get science position address threat.
richardrodriguez780,Logro_1_impact,2024-08-03,With land real finally hour pattern.
richardrodriguez780,Logro_2_fear,2024-04-19,Term top with food.
bailey34781,Logro_0_matter,2024-06-19,Court mention seek institution easy protect media.
bailey34781,Logro_1_recent,2024-02-12,Least ask safe space phone raise.
bailey34781,Logro_2_weight,2023-12-02,Science any mean next state.
theresasantos782,Logro_0_material,2024-02-27,Something ever from after road spring.
theresasantos782,Logro_1_sort,2024-02-23,Yeah black several law clear save.
theresasantos782,Logro_2_several,2024-09-26,Pretty painting edge across responsibility various fast.
cnorman783,Logro_0_trip,2024-10-03,Teach organization produce design discover if.
cnorman783,Logro_1_month,2024-09-03,Gun market mention to center television.
cnorman783,Logro_2_old,2024-11-06,Tree black cup mission center sister.
rsmith784,Logro_0_minute,2024-05-19,Budget family camera second report.
rsmith784,Logro_1_answer,2024-01-19,Wide mean moment scientist.
rsmith784,Logro_2_why,2024-07-18,Side represent paper current surface write for.
aperez785,Logro_0_employee,2024-10-31,Better name loss worry fall special theory.
aperez785,Logro_1_work,2024-09-25,Positive peace growth near forward option need behind.
aperez785,Logro_2_now,2024-07-15,Accept quite grow team through.
sheilapowell786,Logro_0_finally,2023-12-17,So believe positive.
sheilapowell786,Logro_1_material,2024-02-12,Full less whole season environmental couple late.
sheilapowell786,Logro_2_thus,2024-10-21,Investment population blue nation.
hollydavis787,Logro_0_turn,2024-05-01,Source another image feel begin.
hollydavis787,Logro_1_easy,2024-11-18,Old someone age spring decision record.
hollydavis787,Logro_2_major,2024-05-20,Improve back place possible idea.
morganmichael788,Logro_0_thousand,2024-07-30,Perform house voice close detail.
morganmichael788,Logro_1_affect,2023-12-19,Consumer win service mother lose.
morganmichael788,Logro_2_create,2024-04-23,Number course seat national.
wstewart789,Logro_0_somebody,2024-07-09,Family account research bag middle effort they tonight.
wstewart789,Logro_1_even,2024-07-05,Mr live front together billion name.
wstewart789,Logro_2_particular,2024-03-04,Model down nearly information.
jennasalas790,Logro_0_lead,2024-11-03,Business writer bring least.
jennasalas790,Logro_1_eye,2023-11-23,Interesting population little live order open.
jennasalas790,Logro_2_use,2024-05-11,Feeling indicate hair artist.
michaelscott791,Logro_0_room,2024-06-24,Ahead skin anything.
michaelscott791,Logro_1_to,2024-06-19,Likely care bed outside.
michaelscott791,Logro_2_why,2024-09-21,Later two approach shoulder operation.
tanya95792,Logro_0_recognize,2024-04-02,Actually drug international carry.
tanya95792,Logro_1_more,2024-07-03,Place sister ground.
tanya95792,Logro_2_language,2024-05-02,Individual explain offer about president build situation.
dixonmichael793,Logro_0_treat,2024-07-25,Hospital shake both mention.
dixonmichael793,Logro_1_newspaper,2024-02-26,Left computer edge consider.
dixonmichael793,Logro_2_film,2024-03-04,Either news sense at.
kim35794,Logro_0_single,2024-01-27,Institution help result whatever.
