J_Nombre,nombre,fecha_de_adquisicion,descripcion
fishertiffany453,Logro_2_reveal,2024-10-26,Interview thousand question despite.
williamschristine454,Logro_0_send,2024-11-03,Discover box college sound.
williamschristine454,Logro_1_teach,2024-03-08,News offer police.
williamschristine454,Logro_2_from,2024-05-08,Report court high.
alanschultz455,Logro_0_window,2024-07-08,Onto task word three put father purpose specific.
alanschultz455,Logro_1_night,2023-11-30,Style lay main statement grow political exactly.
alanschultz455,Logro_2_argue,2024-11-03,Sure responsibility address product nation condition recognize.
hrobinson456,Logro_0_various,2024-11-16,Special bar size national.
hrobinson456,Logro_1_able,2024-08-10,Organization wrong week including.
hrobinson456,Logro_2_prove,2024-09-13,Policy enough real.
qmiller457,Logro_0_paper,2024-06-14,Sister language watch reason.
qmiller457,Logro_1_western,2024-01-07,Something buy PM radio.
qmiller457,Logro_2_like,2024-02-11,New film understand recently hair fear wide.
gonzalestiffany458,Logro_0_control,2023-12-16,Discuss single collection trip seek order air.
gonzalestiffany458,Logro_1_age,2024-10-28,Throughout option prevent.
gonzalestiffany458,Logro_2_minute,2024-07-18,Bank international design across responsibility.
leewilliam459,Logro_0_hundred,2024-03-08,Between American bed walk during military especially.
leewilliam459,Logro_1_according,2024-05-13,Too buy able those ok officer far.
leewilliam459,Logro_2_draw,2024-03-03,Throughout other design continue.
ginaruiz460,Logro_0_official,2024-06-08,Tell nothing money south building agreement.
ginaruiz460,Logro_1_everybody,2023-12-19,Nothing city check kind modern.
ginaruiz460,Logro_2_because,2024-10-10,Responsibility charge in physical myself government.
adam48461,Logro_0_bar,2024-01-29,Very least someone material another firm plant whether.
adam48461,Logro_1_east,2024-10-09,Against bit tree event serious.
adam48461,Logro_2_drug,2024-09-05,Pm position film difference Democrat.
christinebrooks462,Logro_0_series,2023-12-27,Kind difference history health military fine leg everybody.
christinebrooks462,Logro_1_Mr,2024-09-18,Table ask ask career Mrs.
christinebrooks462,Logro_2_open,2024-03-25,Western after father song.
trevor02463,Logro_0_program,2024-09-09,Church provide skill remember character.
trevor02463,Logro_1_left,2024-04-20,Rock almost officer century three able necessary.
trevor02463,Logro_2_whom,2024-02-02,Style enjoy box front happen.
alex86464,Logro_0_fall,2024-02-19,Dog college himself kind factor everything.
alex86464,Logro_1_suggest,2024-01-15,Finish second coach month something image.
alex86464,Logro_2_adult,2024-03-28,Cell support become listen for record.
elaineosborne465,Logro_0_which,2024-08-20,Student family require effort figure.
elaineosborne465,Logro_1_single,2024-07-17,School source example trip yet.
elaineosborne465,Logro_2_focus,2024-05-11,Catch finish late everyone medical garden.
williamramirez466,Logro_0_follow,2023-12-02,Lot mission travel remain.
williamramirez466,Logro_1_hand,2024-10-03,Town prove hair even girl report hit.
williamramirez466,Logro_2_decision,2024-06-24,Friend four race money.
estradalindsay467,Logro_0_lead,2024-01-14,Easy add red city play mission traditional.
estradalindsay467,Logro_1_ten,2024-04-25,Agency election laugh necessary suffer.
estradalindsay467,Logro_2_table,2024-03-27,Base major close lawyer forward design stuff.
george71468,Logro_0_can,2024-03-05,Option create special American budget their teach dog.
george71468,Logro_1_issue,2024-05-29,Series listen water arm who.
george71468,Logro_2_consumer,2024-09-22,Store design television population child west might.
denise18469,Logro_0_mean,2024-03-30,Side visit prevent relate.
denise18469,Logro_1_consumer,2023-12-26,New like building decision simply amount.
denise18469,Logro_2_according,2024-07-01,Reflect inside sit live moment.
nicholeevans470,Logro_0_process,2023-12-23,Whether way step hot.
nicholeevans470,Logro_1_threat,2024-09-04,Experience respond opportunity reveal different make think lose.
nicholeevans470,Logro_2_fill,2024-01-03,Already law fire western nor apply.
christopher57471,Logro_0_know,2024-10-02,Within speak figure pull.
christopher57471,Logro_1_play,2024-08-28,Seat throw seat truth high man.
christopher57471,Logro_2_item,2024-09-19,Stuff front shake story.
tsmith472,Logro_0_ahead,2024-10-18,Church season next service any similar performance happy.
tsmith472,Logro_1_rate,2024-03-12,Beyond describe suggest respond partner fire need.
tsmith472,Logro_2_American,2024-01-07,Increase finish interest skin management apply.
deannapatterson473,Logro_0_series,2024-03-22,Rise total hour fact relate method nature more.
deannapatterson473,Logro_1_population,2024-02-28,Today foot can.
deannapatterson473,Logro_2_fall,2024-08-31,Admit free pressure face already animal such.
aboyd474,Logro_0_three,2024-03-15,Myself hand drive American.
aboyd474,Logro_1_war,2024-02-08,Affect then important former subject record.
aboyd474,Logro_2_wrong,2024-09-11,Never strategy market treat may care know name.
kennethluna475,Logro_0_tax,2023-11-21,She any improve.
kennethluna475,Logro_1_live,2024-11-15,Whole turn we fine thus.
kennethluna475,Logro_2_discussion,2024-10-25,Kid thank nothing send development.
samuel41476,Logro_0_ok,2024-05-11,Factor recent trial else summer have without.
samuel41476,Logro_1_recently,2024-04-03,Policy analysis lawyer approach choose.
samuel41476,Logro_2_sit,2024-01-14,Store in woman move tree husband term her.
annette79477,Logro_0_article,2023-12-16,Form right number watch.
annette79477,Logro_1_behind,2024-09-05,Book newspaper detail wide eat focus.
annette79477,Logro_2_wind,2024-08-19,Interest get bill whatever.
sydney24478,Logro_0_head,2023-12-02,Year avoid community lot.
sydney24478,Logro_1_federal,2024-09-10,Available move three woman join bad.
sydney24478,Logro_2_back,2024-05-08,Tell she doctor more prepare.
justin55479,Logro_0_production,2023-12-22,Store market choose it spend risk.
justin55479,Logro_1_eye,2024-10-04,Travel guess read role.
justin55479,Logro_2_seven,2024-07-16,Management wish growth above yard purpose.
suttonpaul480,Logro_0_agreement,2024-08-25,Cultural participant eat somebody nature firm song.
suttonpaul480,Logro_1_everyone,2024-04-22,Information after senior thought determine method industry soldier.
suttonpaul480,Logro_2_court,2024-07-13,Board usually thus I.
gwillis481,Logro_0_no,2024-05-31,Score theory quality fight reveal book.
gwillis481,Logro_1_prove,2024-04-13,Goal why note grow they.
gwillis481,Logro_2_adult,2024-05-16,Miss improve throw moment region.
bankstony482,Logro_0_though,2024-08-09,Pass building able radio store new.
bankstony482,Logro_1_compare,2024-05-30,Back huge happen official culture reach.
bankstony482,Logro_2_particular,2024-09-15,Second sing grow mention mean home phone we.
alexander70483,Logro_0_others,2023-12-22,Ever above until president job culture no.
alexander70483,Logro_1_heavy,2024-06-02,Hit cost artist television simply exactly bill unit.
alexander70483,Logro_2_yet,2024-08-02,President fire agent defense machine.
curtisjohn484,Logro_0_clearly,2024-11-04,Number four civil.
curtisjohn484,Logro_1_probably,2024-02-20,Church memory leave.
curtisjohn484,Logro_2_right,2024-04-10,East center meet improve three son benefit peace.
qmolina485,Logro_0_three,2024-11-02,Defense green feel if fund tell let.
qmolina485,Logro_1_foreign,2024-09-30,Half crime PM study push.
qmolina485,Logro_2_population,2024-05-02,Pick hair bank.
kenneth93486,Logro_0_nearly,2023-12-22,Cut feel could such serve especially continue positive.
kenneth93486,Logro_1_style,2024-04-04,Despite begin may man smile enough respond.
kenneth93486,Logro_2_watch,2024-02-22,Home try good.
douglas73487,Logro_0_process,2024-03-01,Through conference cell great house listen voice.
douglas73487,Logro_1_read,2023-12-08,Over trip time central career without single thousand.
douglas73487,Logro_2_former,2024-10-25,Group raise billion usually paper.
michelleskinner488,Logro_0_TV,2024-03-23,Under sort account loss medical behavior character.
michelleskinner488,Logro_1_war,2023-12-26,Space time which situation less base.
michelleskinner488,Logro_2_pass,2024-01-15,Word meeting space article news available.
lisa57489,Logro_0_large,2024-11-02,Type whether water bring Democrat impact fall.
lisa57489,Logro_1_practice,2024-01-24,Toward plan exactly Mr picture.
lisa57489,Logro_2_single,2024-08-24,Third what national both husband.
alisha83490,Logro_0_himself,2024-02-25,Performance push black other front tree clear.
alisha83490,Logro_1_husband,2024-07-27,Produce number from cup network school customer.
alisha83490,Logro_2_should,2024-11-20,Tend wide anyone scientist.
richard45491,Logro_0_foreign,2024-07-11,Real name conference environment debate stock want.
richard45491,Logro_1_develop,2024-11-03,Foot operation trouble significant radio.
richard45491,Logro_2_to,2024-01-19,Throughout it record above ask visit.
maddoxemily492,Logro_0_front,2024-03-28,Big number entire deal customer over region.
maddoxemily492,Logro_1_upon,2024-02-17,Final challenge fear my goal memory.
maddoxemily492,Logro_2_reality,2024-04-18,Of along find low.
patrickjimenez493,Logro_0_stage,2024-06-14,Maybe tax prepare in until parent building.
patrickjimenez493,Logro_1_respond,2024-07-11,Yes space benefit low.
patrickjimenez493,Logro_2_role,2024-05-02,And relationship force perform.
lynnmandy494,Logro_0_three,2024-03-22,Add receive truth do country.
lynnmandy494,Logro_1_develop,2024-11-05,Mission movement member forget.
lynnmandy494,Logro_2_learn,2024-04-29,Certainly glass cultural born doctor my young investment.
mcclurejimmy495,Logro_0_voice,2023-12-30,Figure professional official.
mcclurejimmy495,Logro_1_by,2024-07-18,Important notice light land.
mcclurejimmy495,Logro_2_way,2024-10-18,Discuss figure stop stuff stock student.
richard50496,Logro_0_feeling,2023-12-28,Race nor several stand.
richard50496,Logro_1_see,2024-07-22,Only yet majority past.
richard50496,Logro_2_agency,2024-05-07,Car but anyone wife they another five.
hernandezwanda497,Logro_0_conference,2024-06-27,Tell almost question choice clearly forward western.
hernandezwanda497,Logro_1_organization,2023-11-21,Bit hand trial the peace sell.
hernandezwanda497,Logro_2_have,2024-02-02,First man quickly plant career.
nmartinez498,Logro_0_science,2024-02-14,Whatever only kitchen both establish response.
nmartinez498,Logro_1_help,2024-01-13,Then another later finally.
nmartinez498,Logro_2_picture,2023-12-20,Analysis set church assume pretty.
richard37499,Logro_0_clear,2024-05-17,Sometimes current small window.
richard37499,Logro_1_crime,2024-07-06,Form minute write this describe forget century perform.
richard37499,Logro_2_than,2024-04-06,Involve information again factor involve example person.
garcialarry500,Logro_0_try,2024-02-02,Employee these stay behind.
garcialarry500,Logro_1_couple,2024-08-17,Reason already action hit those when popular century.
garcialarry500,Logro_2_relate,2024-04-04,Reflect power instead recent determine else.
christiegarcia501,Logro_0_rise,2023-12-07,Until college focus mention.
christiegarcia501,Logro_1_over,2024-07-26,Middle I last reveal the amount.
christiegarcia501,Logro_2_may,2023-11-30,Piece analysis middle now church side.
qbridges502,Logro_0_cost,2023-12-10,Early push among recent be leg those.
qbridges502,Logro_1_from,2024-09-15,List side response her.
qbridges502,Logro_2_I,2024-08-18,Nor day authority real item too news.
robert91503,Logro_0_everything,2024-05-23,Mr morning take manage over.
robert91503,Logro_1_maintain,2024-08-12,Agree town let new politics.
robert91503,Logro_2_case,2024-05-10,Tell sound there mean understand money million.
wilsonmichael504,Logro_0_agree,2024-09-13,Whether than billion employee especially.
wilsonmichael504,Logro_1_reduce,2024-06-03,Lead him seven doctor research.
wilsonmichael504,Logro_2_attention,2024-02-07,Else industry wife film bit dark moment also.
ccain505,Logro_0_among,2024-08-28,Suggest hold paper actually wrong least.
ccain505,Logro_1_behind,2024-08-23,Single option recognize sit deep development clear.
ccain505,Logro_2_writer,2023-12-21,Citizen somebody people think building charge.
vincent57506,Logro_0_sing,2024-10-18,Law as oil check green nation.
vincent57506,Logro_1_recognize,2024-04-13,Imagine point really able night great must.
vincent57506,Logro_2_culture,2024-11-08,Me second interview political.
davidfleming507,Logro_0_share,2024-06-18,Concern management enter look charge indicate.
davidfleming507,Logro_1_understand,2024-10-01,House fast catch lawyer stuff house help.
davidfleming507,Logro_2_end,2024-10-15,Within argue as suddenly various.
valdezraymond508,Logro_0_just,2023-12-15,Generation heart local billion treatment religious.
valdezraymond508,Logro_1_from,2023-12-02,Risk say whether share traditional may.
valdezraymond508,Logro_2_dog,2023-12-10,Teacher structure their this trade.
kathrynburns509,Logro_0_pay,2024-04-02,Teacher evidence part management point.
kathrynburns509,Logro_1_read,2024-07-09,Claim strong campaign discuss store north.
kathrynburns509,Logro_2_idea,2024-09-21,Book act staff attorney cultural.
michaelwalters510,Logro_0_explain,2024-04-30,Maintain clear boy discuss sport.
michaelwalters510,Logro_1_find,2024-04-05,Own night employee.
michaelwalters510,Logro_2_rest,2024-10-23,Usually government upon power improve including peace.
jonathan50511,Logro_0_bar,2024-11-12,Wide part but company safe Republican stuff.
jonathan50511,Logro_1_eat,2024-05-10,Team usually people free yard.
jonathan50511,Logro_2_fall,2024-08-26,Once within seem.
riveramichelle512,Logro_0_business,2024-11-17,Lose high reflect tonight language one address.
riveramichelle512,Logro_1_admit,2024-09-05,Why focus about particular party.
riveramichelle512,Logro_2_others,2024-05-11,Can similar place more daughter door wear.
ashley91513,Logro_0_federal,2024-07-11,Run American major take property happen.
ashley91513,Logro_1_conference,2023-11-22,These interview evidence more know who.
ashley91513,Logro_2_impact,2024-07-31,Product difficult parent spend.
calebgarrett514,Logro_0_turn,2024-04-28,Prevent clearly between cultural man.
calebgarrett514,Logro_1_nation,2024-08-09,Control number change road.
calebgarrett514,Logro_2_bad,2024-09-17,Wear year single increase challenge.
carterjenna515,Logro_0_even,2024-10-11,Price show how shoulder anything.
carterjenna515,Logro_1_whose,2024-07-18,Half threat upon leader success.
carterjenna515,Logro_2_trip,2024-09-07,Anything away year physical court coach yourself.
caroljensen516,Logro_0_thought,2024-07-10,Effect yet rate book lot.
caroljensen516,Logro_1_put,2023-12-07,Some church service key part.
caroljensen516,Logro_2_spring,2024-09-23,Time commercial son themselves that commercial partner.
brittany18517,Logro_0_response,2023-11-21,No want outside enough.
brittany18517,Logro_1_have,2024-03-03,Three enough assume want Democrat.
brittany18517,Logro_2_back,2024-07-07,Owner happen side policy issue.
wrightmartha518,Logro_0_head,2024-03-18,Cultural bed movement miss as charge task.
wrightmartha518,Logro_1_person,2024-10-04,Manager discover make.
wrightmartha518,Logro_2_my,2024-11-18,Official PM simple one mention.
smithaaron519,Logro_0_ago,2024-03-04,Rather include go.
smithaaron519,Logro_1_open,2024-07-24,Old consumer occur for full change.
smithaaron519,Logro_2_brother,2024-01-18,Clearly future down ask expect.
wcabrera520,Logro_0_bit,2023-12-20,Goal moment religious unit might country drug.
wcabrera520,Logro_1_produce,2023-12-13,Stage clearly week friend.
wcabrera520,Logro_2_he,2024-06-07,Order church cover.
cruzjason521,Logro_0_live,2023-12-24,Glass watch majority reveal together.
cruzjason521,Logro_1_tonight,2024-06-18,Boy civil reason pressure almost also.
cruzjason521,Logro_2_various,2024-05-30,Fall much after source.
walkermark522,Logro_0_us,2024-02-04,Ask side reality meeting main.
walkermark522,Logro_1_form,2024-01-29,Great walk administration there.
walkermark522,Logro_2_compare,2024-05-19,Space husband tax type would.
benitezkenneth523,Logro_0_by,2024-11-05,Ask base room it event floor.
benitezkenneth523,Logro_1_my,2024-11-18,Add partner act democratic.
benitezkenneth523,Logro_2_force,2024-05-26,Safe writer people Mr wish idea.
millervirginia524,Logro_0_behavior,2024-05-27,Remember stay field education notice same production.
millervirginia524,Logro_1_system,2024-09-17,Generation similar everyone sea.
millervirginia524,Logro_2_order,2024-07-10,Officer free could capital.
qandrews525,Logro_0_nature,2024-08-04,Right power glass above answer last.
qandrews525,Logro_1_just,2024-05-23,Arm art room later.
qandrews525,Logro_2_learn,2024-07-09,Democrat over yeah woman suddenly save dog.
aaronfowler526,Logro_0_partner,2024-04-04,Ok set cause fine free.
aaronfowler526,Logro_1_science,2024-01-27,On scene sit.
aaronfowler526,Logro_2_bring,2024-09-27,Should ever them usually daughter evening.
laurenchung527,Logro_0_decade,2024-11-05,Song speak tax character worry.
laurenchung527,Logro_1_glass,2024-07-23,Than especially onto.
laurenchung527,Logro_2_section,2023-12-28,Tv mind likely seat.
kimberlydiaz528,Logro_0_describe,2024-11-04,Cell strong big else.
kimberlydiaz528,Logro_1_during,2024-09-08,Sometimes start general occur animal nor.
kimberlydiaz528,Logro_2_cell,2024-08-28,During indicate this dark prepare.
kylecook529,Logro_0_everything,2024-06-27,Current decade cold assume.
kylecook529,Logro_1_never,2024-08-06,Painting still yard war personal.
kylecook529,Logro_2_professional,2024-02-01,Talk part if a.
ibaker530,Logro_0_she,2024-03-13,Whose contain shake meet.
ibaker530,Logro_1_total,2024-07-28,Pay energy page unit store couple.
ibaker530,Logro_2_off,2024-02-27,Suddenly various until nature information foreign she.
hballard531,Logro_0_long,2024-05-26,Put establish expect approach skill.
hballard531,Logro_1_take,2024-07-27,Author eight usually ability once move.
hballard531,Logro_2_race,2024-11-13,Civil book if law.
buchanandouglas532,Logro_0_newspaper,2024-05-07,Rather word along believe.
buchanandouglas532,Logro_1_describe,2024-08-19,Cost share seem.
buchanandouglas532,Logro_2_hospital,2024-07-01,Whether rate democratic threat policy program tax.
lshannon533,Logro_0_assume,2024-02-27,Believe together different difficult wind model wall.
lshannon533,Logro_1_tough,2024-08-02,Others study view against task this.
lshannon533,Logro_2_everybody,2024-08-12,Decide federal at evidence pay.
whitevincent534,Logro_0_security,2024-07-26,Those arm why.
whitevincent534,Logro_1_heart,2024-06-02,Know occur feel better hundred.
whitevincent534,Logro_2_security,2024-04-28,Order city board.
omurphy535,Logro_0_guess,2024-03-29,Five add tax.
omurphy535,Logro_1_across,2023-12-18,Claim professor sign card state close while situation.
omurphy535,Logro_2_defense,2024-02-03,Hand war successful oil box.
glewis536,Logro_0_note,2024-04-29,Drop site hand author wide little strong.
glewis536,Logro_1_financial,2024-10-03,Able over population adult tree town third.
glewis536,Logro_2_big,2024-05-29,Around finish wall hard three myself.
katelynandersen537,Logro_0_knowledge,2024-09-27,Father once recognize carry relate address.
katelynandersen537,Logro_1_another,2024-06-11,Response term investment painting region represent through.
katelynandersen537,Logro_2_suddenly,2023-11-28,Own wait democratic thus.
donnayoder538,Logro_0_exist,2024-03-28,Throughout sort least seat class beautiful ability.
donnayoder538,Logro_1_prove,2024-03-09,Ready professional read lawyer.
donnayoder538,Logro_2_vote,2024-09-28,Message somebody push.
qbrown539,Logro_0_growth,2024-08-12,Simple girl tonight style wear cold wear.
qbrown539,Logro_1_white,2024-03-11,View discuss but expect laugh marriage.
qbrown539,Logro_2_himself,2024-02-07,Far lawyer performance consumer teacher.
joshuacarlson540,Logro_0_ago,2024-09-04,Process hundred team population call.
joshuacarlson540,Logro_1_suggest,2024-10-22,Tell meet appear.
joshuacarlson540,Logro_2_wall,2024-02-26,Politics technology another check.
curtis37541,Logro_0_of,2024-04-01,President pass note threat recent option I.
curtis37541,Logro_1_modern,2024-05-02,Campaign attack whole care thousand Congress doctor.
curtis37541,Logro_2_the,2024-06-15,Score later research bit voice three.
marcussmall542,Logro_0_body,2024-02-02,Understand situation standard responsibility also its growth real.
marcussmall542,Logro_1_together,2024-04-08,Agree woman method surface.
marcussmall542,Logro_2_they,2024-08-24,General measure under this share weight light.
barnesmichael543,Logro_0_soldier,2023-11-27,Cost very full near sea old popular.
barnesmichael543,Logro_1_while,2024-01-22,Collection letter deep sign send buy go responsibility.
barnesmichael543,Logro_2_hard,2024-09-05,Near use result little whole goal.
courtneyjones544,Logro_0_surface,2023-12-31,Half positive chance meet letter happy.
courtneyjones544,Logro_1_grow,2024-11-03,Build him not hard turn not sing.
courtneyjones544,Logro_2_soldier,2024-08-25,Doctor miss difficult foot artist.
mhull545,Logro_0_need,2024-05-22,Morning which must physical network contain reflect.
mhull545,Logro_1_produce,2024-06-13,Town at three market particularly remember.
mhull545,Logro_2_boy,2023-12-28,With action like nation wonder.
zbrooks546,Logro_0_city,2023-11-21,Know student civil miss although.
zbrooks546,Logro_1_wife,2024-04-11,Magazine pattern occur college.
zbrooks546,Logro_2_about,2024-09-17,Affect hope about bring.
wnicholson547,Logro_0_skin,2024-03-16,Various ability management tough outside.
wnicholson547,Logro_1_describe,2024-11-06,Method walk bank fact physical.
wnicholson547,Logro_2_style,2024-06-22,Near spring she physical only reason our no.
brandonlogan548,Logro_0_factor,2024-04-30,Provide education management.
brandonlogan548,Logro_1_modern,2024-04-25,Stage clear read wide area exactly.
brandonlogan548,Logro_2_it,2023-11-29,Finish long ahead although seat.
vpham549,Logro_0_month,2024-11-05,Your oil town cut.
vpham549,Logro_1_hundred,2024-02-12,Behind body fill mouth image general theory.
vpham549,Logro_2_interview,2023-12-05,Under where travel recognize.
valerieross550,Logro_0_road,2024-02-14,Senior attention control more.
valerieross550,Logro_1_rise,2024-03-16,Pick can party room two their.
valerieross550,Logro_2_include,2024-05-04,Author any yeah main world attack your.
ericcrawford551,Logro_0_soldier,2024-05-25,Between that party major.
ericcrawford551,Logro_1_address,2024-06-14,Reflect against partner place.
ericcrawford551,Logro_2_choice,2024-07-13,Always tonight prepare collection cover identify determine.
salinaslaura552,Logro_0_house,2024-02-18,Most service price help attention.
salinaslaura552,Logro_1_quality,2024-06-02,Unit far worker argue ability.
salinaslaura552,Logro_2_around,2024-08-30,Want later trade by become.
pruiz553,Logro_0_help,2024-03-31,Building true because able.
pruiz553,Logro_1_tough,2024-02-10,Sell red perhaps approach paper agreement.
pruiz553,Logro_2_help,2023-12-18,Pick produce performance put authority discover result.
davisamanda554,Logro_0_week,2024-09-05,Court image budget occur.
davisamanda554,Logro_1_four,2024-10-05,Into coach hospital onto appear teacher tell.
davisamanda554,Logro_2_herself,2024-05-30,Even successful walk arrive.
mcguirechristina555,Logro_0_yourself,2024-07-06,Half inside family true bag prove.
mcguirechristina555,Logro_1_body,2024-11-20,Anyone fill area last.
mcguirechristina555,Logro_2_capital,2024-06-08,Enough natural give field Congress citizen.
urodriguez556,Logro_0_page,2024-10-09,Color dinner serious morning.
urodriguez556,Logro_1_teach,2024-04-02,Number leader economic season unit rate conference next.
urodriguez556,Logro_2_relate,2024-03-01,Decade concern ago bring believe.
john09557,Logro_0_majority,2024-08-24,Add new appear month finish risk per.
john09557,Logro_1_relationship,2023-12-27,Power television leader bad peace work carry.
john09557,Logro_2_probably,2024-09-20,Enjoy determine truth ago can.
kellyfrederick558,Logro_0_light,2024-09-02,Medical growth both shake once hand.
kellyfrederick558,Logro_1_sort,2024-10-02,Present send game involve scene reason.
kellyfrederick558,Logro_2_throughout,2024-04-29,Color share herself no soon case.
jonesjohn559,Logro_0_call,2024-11-12,Marriage explain black discussion total.
jonesjohn559,Logro_1_see,2024-09-16,Particularly consider put institution firm drug water finally.
jonesjohn559,Logro_2_focus,2024-11-20,Establish us type trade.
davisrobert560,Logro_0_indeed,2024-07-29,Heavy pay hot.
davisrobert560,Logro_1_food,2024-02-05,Former big respond more.
davisrobert560,Logro_2_democratic,2023-12-04,Consider high rock section part under project.
iholt561,Logro_0_fire,2023-12-01,Job responsibility generation wear itself child sort.
iholt561,Logro_1_together,2024-05-14,Car environment my bed church source.
iholt561,Logro_2_certainly,2024-01-15,Arm agent southern a authority left.
ptucker562,Logro_0_hold,2024-10-18,Receive value three item whole.
ptucker562,Logro_1_federal,2024-02-29,Natural pass cup at ball.
ptucker562,Logro_2_many,2024-08-16,Exist meeting option drive order break.
dixonjonathan563,Logro_0_pattern,2024-04-20,Before staff understand.
dixonjonathan563,Logro_1_fill,2024-04-03,No air myself develop.
dixonjonathan563,Logro_2_write,2024-06-05,Fly charge forward series ask.
michaeldavis564,Logro_0_lay,2024-06-08,Bank skill but respond.
michaeldavis564,Logro_1_community,2023-12-29,Drug course dinner senior trouble environmental real.
michaeldavis564,Logro_2_various,2024-02-18,Stay politics popular help ball.
timothy97565,Logro_0_think,2024-07-29,Performance religious space.
timothy97565,Logro_1_true,2024-06-12,Husband relate former use early trouble.
timothy97565,Logro_2_wear,2024-10-04,Along page whatever clear line after.
ramoslori566,Logro_0_under,2024-03-14,Individual effort current have perhaps.
ramoslori566,Logro_1_maintain,2024-05-09,Team either turn have effect management remain.
