J_Nombre,nombre,fecha_de_adquisicion,descripcion
connie73228,Logro_0_property,2024-09-18,Soon party response worker.
connie73228,Logro_1_however,2023-12-16,Least single when fire significant attention month.
connie73228,Logro_2_movement,2024-07-15,Account strategy surface design prevent.
ashleyclayton229,Logro_0_project,2024-03-11,Must control blue actually while capital less foot.
ashleyclayton229,Logro_1_fly,2024-03-02,Once daughter never often.
ashleyclayton229,Logro_2_hear,2024-03-30,Itself month involve.
richardpatterson230,Logro_0_board,2024-06-25,Structure already with.
richardpatterson230,Logro_1_behavior,2024-07-18,Require another old seem above talk.
richardpatterson230,Logro_2_class,2024-07-30,Back standard according rise leave yes.
anita41231,Logro_0_especially,2024-09-09,Could road can show.
anita41231,Logro_1_church,2024-10-23,Artist force role until.
anita41231,Logro_2_point,2024-10-24,Authority visit range draw.
christina57232,Logro_0_state,2023-11-28,Make already vote enjoy customer leave sing part.
christina57232,Logro_1_continue,2024-06-16,Understand sing start case.
christina57232,Logro_2_responsibility,2024-09-29,Never woman culture human only live exactly.
kellifrederick233,Logro_0_no,2024-06-17,Back certain himself someone place.
kellifrederick233,Logro_1_much,2024-10-24,Stuff car adult human Mrs.
kellifrederick233,Logro_2_first,2024-08-27,News off can enjoy.
xbaker234,Logro_0_dog,2024-07-21,That mouth hold mission short nation.
xbaker234,Logro_1_central,2024-07-18,Just order evening organization.
xbaker234,Logro_2_baby,2024-02-09,Loss good career level.
sarabrown235,Logro_0_necessary,2024-09-29,Itself somebody speak again whether court discover.
sarabrown235,Logro_1_minute,2024-09-24,Let campaign vote evening century place speak.
sarabrown235,Logro_2_draw,2024-07-03,Describe federal attention war.
igilbert236,Logro_0_keep,2024-04-15,Represent possible place describe individual moment project heart.
igilbert236,Logro_1_yard,2024-09-18,Present you reveal become across.
igilbert236,Logro_2_bit,2023-12-18,Public last study result protect.
wanda34237,Logro_0_produce,2024-09-01,Run time station on build defense.
wanda34237,Logro_1_out,2024-08-23,Risk dream hold water trade agent manager.
wanda34237,Logro_2_quickly,2024-03-11,Argue defense current us along.
shannonarmstrong238,Logro_0_former,2024-11-04,Yes would act remain peace coach by.
shannonarmstrong238,Logro_1_east,2024-11-17,Tend on position project from speech article end.
shannonarmstrong238,Logro_2_attorney,2024-09-19,Value baby between catch.
mistycarter239,Logro_0_break,2023-11-26,Final decision body.
mistycarter239,Logro_1_our,2024-09-06,Too bad analysis effort boy let voice.
mistycarter239,Logro_2_situation,2024-01-19,It investment why somebody apply commercial always.
bestkimberly240,Logro_0_and,2024-07-03,Effort majority sit size region crime what reach.
bestkimberly240,Logro_1_finally,2024-11-11,Organization rule social child.
bestkimberly240,Logro_2_she,2024-01-10,Light after ball ok.
phillipsbenjamin241,Logro_0_machine,2024-09-12,Fall because magazine today.
phillipsbenjamin241,Logro_1_far,2024-06-13,Clearly help site.
phillipsbenjamin241,Logro_2_cold,2024-03-11,Think area pay everyone.
buckjoseph242,Logro_0_assume,2024-07-31,International stop only standard.
buckjoseph242,Logro_1_measure,2024-10-21,Parent about cell himself.
buckjoseph242,Logro_2_him,2024-01-26,Cost seat difference boy describe respond.
sean89243,Logro_0_fact,2024-03-17,Almost develop trial well artist marriage.
sean89243,Logro_1_address,2023-11-30,Market hotel nothing check.
sean89243,Logro_2_sell,2024-10-05,Specific part husband give.
campbellkathleen244,Logro_0_process,2024-05-29,This call common within ability fight.
campbellkathleen244,Logro_1_soldier,2024-05-10,Increase information worry range.
campbellkathleen244,Logro_2_arrive,2024-03-06,Few goal answer Mr measure sister nice.
michael03245,Logro_0_court,2024-01-25,Include list put back explain talk big.
michael03245,Logro_1_daughter,2024-08-19,Cultural ever forward record society wait.
michael03245,Logro_2_focus,2023-12-05,City place young because whole.
tommykelly246,Logro_0_nor,2024-06-17,Star thing start activity financial end.
tommykelly246,Logro_1_turn,2024-08-30,Collection forget still customer its.
tommykelly246,Logro_2_by,2024-03-27,Along follow manager history interest always.
jacquelinerichards247,Logro_0_operation,2024-03-31,Near guess blood news appear.
jacquelinerichards247,Logro_1_during,2024-05-25,Defense better serious daughter usually manage easy.
jacquelinerichards247,Logro_2_international,2024-07-23,Prepare wait growth.
schultzjennifer248,Logro_0_wrong,2024-08-04,Wait visit fight song Congress hit best.
schultzjennifer248,Logro_1_before,2024-07-01,Cause participant suddenly identify outside song.
schultzjennifer248,Logro_2_by,2024-05-08,Design what help without American rise fine.
xpeterson249,Logro_0_have,2024-08-25,Into court into arm part strong item.
xpeterson249,Logro_1_hour,2023-12-13,Pattern together up agree reality.
xpeterson249,Logro_2_west,2024-02-15,Mind behind indicate student.
lmartin250,Logro_0_determine,2023-12-13,Thing father rise store tough billion.
lmartin250,Logro_1_onto,2024-05-24,Generation success deep nothing process kitchen.
lmartin250,Logro_2_culture,2024-11-14,Social middle close guy.
msmith251,Logro_0_area,2024-08-19,Structure trouble president large store.
msmith251,Logro_1_black,2024-06-30,Bank option after be bit decade.
msmith251,Logro_2_because,2023-11-21,Significant activity yeah religious red since across.
danielstevens252,Logro_0_occur,2024-05-07,Check bag rock different.
danielstevens252,Logro_1_wear,2024-05-09,Have involve else leave color street.
danielstevens252,Logro_2_sister,2024-02-21,Cost none recent when floor.
fitzgeraldjacqueline253,Logro_0_environmental,2024-04-19,Vote let movement several stay poor day avoid.
fitzgeraldjacqueline253,Logro_1_attention,2024-04-10,Around expert new school probably through available.
fitzgeraldjacqueline253,Logro_2_air,2024-06-21,Shoulder public share tend reach instead.
vbentley254,Logro_0_stop,2024-07-23,Management other meet field current television laugh.
vbentley254,Logro_1_with,2024-04-19,Know piece church range center each.
vbentley254,Logro_2_bit,2024-05-29,That staff night there.
wileykimberly255,Logro_0_whole,2024-06-02,Ability marriage common among although window.
wileykimberly255,Logro_1_four,2024-06-05,Common space direction company approach.
wileykimberly255,Logro_2_trouble,2024-08-25,Mean white response together shoulder require.
npollard256,Logro_0_kind,2024-04-22,Hair force me.
npollard256,Logro_1_force,2024-01-07,Series life watch entire them size.
npollard256,Logro_2_condition,2024-03-02,Agent pull guess itself star.
dorseyrussell257,Logro_0_condition,2024-05-30,Many particularly memory anything truth behind agency finally.
dorseyrussell257,Logro_1_ok,2024-01-19,Discuss beat sister poor.
dorseyrussell257,Logro_2_anything,2024-01-28,Level side face picture conference alone stand western.
ngilmore258,Logro_0_money,2024-03-20,Defense civil likely mission window beyond.
ngilmore258,Logro_1_activity,2024-03-10,Describe box nice parent account.
ngilmore258,Logro_2_address,2024-05-29,Decision mouth left the finish think give.
mortontimothy259,Logro_0_pattern,2024-09-01,Pay team leave owner change minute.
mortontimothy259,Logro_1_bank,2024-10-15,Economy tax as beautiful include respond region.
mortontimothy259,Logro_2_do,2024-04-08,Staff list relate although book.
wharvey260,Logro_0_notice,2024-06-17,Even theory side.
wharvey260,Logro_1_effort,2024-09-04,Area call who issue development.
wharvey260,Logro_2_country,2024-07-31,Development she recently again on.
sheila17261,Logro_0_range,2024-05-28,Article interview able.
sheila17261,Logro_1_force,2024-07-23,Serious large chance traditional minute with major.
sheila17261,Logro_2_item,2024-06-30,Address director better fund far meeting.
kristymcdaniel262,Logro_0_coach,2024-07-07,Manager movie detail.
kristymcdaniel262,Logro_1_miss,2024-04-07,Within there school stage.
kristymcdaniel262,Logro_2_have,2024-05-14,History late trial environment understand.
shannonnavarro263,Logro_0_act,2024-07-17,Process federal say popular effect.
shannonnavarro263,Logro_1_around,2024-09-19,Owner focus join today.
shannonnavarro263,Logro_2_painting,2024-06-24,Cover quickly administration perform under involve wait hope.
john80264,Logro_0_week,2024-06-15,Character relationship foot carry hear.
john80264,Logro_1_blue,2024-01-09,Despite miss police figure clear citizen news wide.
john80264,Logro_2_amount,2024-06-30,Executive charge vote also free item own.
joseph51265,Logro_0_peace,2023-12-06,Customer action food leave rich air whom.
joseph51265,Logro_1_why,2024-09-09,Stop wait collection when energy need alone offer.
joseph51265,Logro_2_whose,2024-05-25,Appear partner suddenly Republican after picture style.
jesse92266,Logro_0_amount,2024-01-19,Attack citizen party of.
jesse92266,Logro_1_especially,2024-08-02,Hour magazine drive manage field.
jesse92266,Logro_2_son,2024-08-20,Project during consider pretty majority whether.
michelle39267,Logro_0_go,2024-11-16,Cell movie position card.
michelle39267,Logro_1_prove,2024-04-09,Guess same who home officer stage.
michelle39267,Logro_2_conference,2024-09-14,Concern seek speak late.
rklein268,Logro_0_charge,2024-09-21,Even year continue economic season plan.
rklein268,Logro_1_civil,2024-05-02,Dark food for recognize ahead board.
rklein268,Logro_2_cultural,2024-04-27,Difference inside traditional fast.
cathyrichmond269,Logro_0_side,2024-09-13,Ball produce let keep listen.
cathyrichmond269,Logro_1_behind,2024-03-23,World establish west.
cathyrichmond269,Logro_2_lose,2024-08-05,Seek against brother film.
sarah75270,Logro_0_experience,2024-04-05,Likely firm young give step finish until.
sarah75270,Logro_1_understand,2024-03-02,Wall table memory choice visit if.
sarah75270,Logro_2_PM,2024-05-12,Success no worker front visit.
garrettdeborah271,Logro_0_hope,2024-11-18,Artist community minute total coach system.
garrettdeborah271,Logro_1_church,2024-07-15,Compare skin she up answer none a.
garrettdeborah271,Logro_2_recently,2024-05-29,Also compare trial.
jason26272,Logro_0_account,2024-11-05,Key network chair medical human though himself.
jason26272,Logro_1_education,2024-10-19,Stage hold purpose accept several both mention.
jason26272,Logro_2_happy,2024-07-16,Morning anyone least generation.
nathan04273,Logro_0_tell,2023-11-24,Than inside picture learn never.
nathan04273,Logro_1_statement,2024-09-09,Over reality would school.
nathan04273,Logro_2_management,2024-01-06,Hard read doctor physical man doctor.
hannahharris274,Logro_0_give,2024-10-23,Action quality need girl tonight know dark.
hannahharris274,Logro_1_price,2024-03-04,General discuss go heavy leave.
hannahharris274,Logro_2_less,2024-07-08,Firm check our staff operation remain available.
martinkristy275,Logro_0_future,2024-04-18,Mouth piece interest mother.
martinkristy275,Logro_1_return,2024-05-11,Nature may knowledge reduce especially green.
martinkristy275,Logro_2_instead,2024-06-04,Film wrong according behavior manager across water always.
tgonzales276,Logro_0_artist,2024-09-13,Professor fly manager reveal.
tgonzales276,Logro_1_able,2024-05-09,Seem among mother city.
tgonzales276,Logro_2_boy,2023-11-25,Real fill on.
ypeterson277,Logro_0_cut,2024-09-18,Side beautiful enjoy media lawyer.
ypeterson277,Logro_1_conference,2023-12-10,Company stuff conference enjoy born key.
ypeterson277,Logro_2_inside,2023-12-05,Worker million laugh particular always.
elizabeth36278,Logro_0_rather,2024-07-04,Hard guy skill wall.
elizabeth36278,Logro_1_exactly,2024-03-23,Small worry play everything religious worry.
elizabeth36278,Logro_2_player,2024-11-06,Executive tax civil way school organization body.
robertdavis279,Logro_0_own,2024-11-13,Particular rest son range speech start.
robertdavis279,Logro_1_sense,2024-10-06,Practice end always word hundred perform nothing.
robertdavis279,Logro_2_team,2024-07-29,Democrat food author view scientist.
henrykenneth280,Logro_0_describe,2023-12-28,Team bank simply teach.
henrykenneth280,Logro_1_their,2024-04-21,Upon series paper born.
henrykenneth280,Logro_2_significant,2024-08-25,Sort door base as officer sense party.
fharmon281,Logro_0_six,2024-07-05,Land current I her four.
fharmon281,Logro_1_bar,2024-05-17,Back yes close hotel wind above.
fharmon281,Logro_2_politics,2024-05-27,Rest energy high real wish growth within nearly.
fgalvan282,Logro_0_camera,2024-08-17,Five court represent decade player child your.
fgalvan282,Logro_1_sign,2024-09-16,Ask something necessary at lead.
fgalvan282,Logro_2_north,2024-03-12,Or red democratic.
jim26283,Logro_0_own,2024-08-17,Enter growth guess three suddenly right economic.
jim26283,Logro_1_option,2024-07-20,Nation rule ball camera skin traditional.
jim26283,Logro_2_success,2024-10-04,Study station data.
goulderic284,Logro_0_church,2024-10-26,Experience buy next item operation.
goulderic284,Logro_1_standard,2024-10-26,Administration experience voice film build well medical.
goulderic284,Logro_2_let,2024-06-12,Four even throw painting.
sydney74285,Logro_0_water,2024-10-11,Congress knowledge vote pull around.
sydney74285,Logro_1_far,2024-06-15,Court herself big about thought stage.
sydney74285,Logro_2_land,2024-07-12,Attorney leave miss whom most factor.
nathancannon286,Logro_0_think,2024-07-16,Tough claim open as nothing yet hope.
nathancannon286,Logro_1_her,2024-08-13,Field imagine statement military significant race.
nathancannon286,Logro_2_perform,2024-03-19,Drug speech member picture outside evening.
burnsjessica287,Logro_0_into,2024-07-20,Pretty fact story this.
burnsjessica287,Logro_1_reach,2024-05-27,Avoid bed ability challenge likely.
burnsjessica287,Logro_2_oil,2024-11-16,Reach night weight treat beat mouth.
coryhaynes288,Logro_0_project,2024-09-01,Particular speech hope inside bill threat network.
coryhaynes288,Logro_1_source,2024-07-28,Health road woman week whatever create.
coryhaynes288,Logro_2_position,2024-01-31,However upon throughout easy than leave bill.
johnsonchristopher289,Logro_0_respond,2024-09-06,National throw the same already strategy dream.
johnsonchristopher289,Logro_1_certain,2024-01-10,Entire return drug throughout energy.
johnsonchristopher289,Logro_2_cultural,2024-08-29,After full six short power city and.
kpacheco290,Logro_0_stage,2024-01-10,House affect media like attack after fine become.
kpacheco290,Logro_1_through,2024-07-25,Military seem order describe four.
kpacheco290,Logro_2_nearly,2024-08-17,Most last magazine rest democratic peace and.
emily67291,Logro_0_much,2024-01-16,Ability head society behind including.
emily67291,Logro_1_occur,2024-07-05,Employee most his never fly these.
emily67291,Logro_2_dinner,2024-04-07,Record sound expect account future occur word.
jacobtaylor292,Logro_0_senior,2024-04-07,Financial might represent similar treatment condition road.
jacobtaylor292,Logro_1_data,2024-07-18,Behind themselves paper dog best young matter.
jacobtaylor292,Logro_2_after,2023-11-24,Moment let side no six.
maryjones293,Logro_0_force,2024-09-25,Ten herself young number customer own idea.
maryjones293,Logro_1_bar,2024-01-25,Interesting suggest least hold some back teach industry.
maryjones293,Logro_2_finish,2024-10-08,Analysis born visit father agent least apply.
taylorjustin294,Logro_0_side,2024-11-13,Over four trip score vote yes meeting.
taylorjustin294,Logro_1_organization,2024-05-22,Add door woman building friend.
taylorjustin294,Logro_2_clear,2024-06-05,Occur event between range.
kennedymary295,Logro_0_international,2024-10-01,Growth material feeling machine how citizen.
kennedymary295,Logro_1_bag,2023-12-31,Power article American why.
kennedymary295,Logro_2_local,2024-07-31,Effort prevent hospital own.
ineal296,Logro_0_country,2024-08-24,Very floor so from.
ineal296,Logro_1_order,2024-06-19,Program choice nice do never per voice.
ineal296,Logro_2_sea,2024-01-23,Several likely international no job theory.
ymurray297,Logro_0_middle,2024-05-07,Everything huge think bill drug pattern investment.
ymurray297,Logro_1_you,2023-12-16,Serve yard those four.
ymurray297,Logro_2_campaign,2024-06-16,Dark hope on wall wish floor learn.
hernandezsheila298,Logro_0_term,2023-12-19,Heart recently war.
hernandezsheila298,Logro_1_already,2024-01-07,Each almost government exactly she.
hernandezsheila298,Logro_2_after,2024-08-20,Positive close capital hear.
holmestracy299,Logro_0_imagine,2024-02-07,Democratic onto prevent where the.
holmestracy299,Logro_1_response,2024-07-18,Statement toward a manage.
holmestracy299,Logro_2_although,2024-08-12,Get authority particular guess note discuss.
danieljacobson300,Logro_0_true,2024-06-08,Guess find bit summer society alone dog.
danieljacobson300,Logro_1_certain,2024-11-17,So dog nice oil who.
danieljacobson300,Logro_2_join,2023-12-17,Explain reality again entire entire.
lmartinez301,Logro_0_history,2023-12-02,Consider report price relationship mind phone hit.
lmartinez301,Logro_1_brother,2024-09-25,Study him beat everybody student total.
lmartinez301,Logro_2_ok,2024-04-28,Respond suggest agreement deal.
karina04302,Logro_0_education,2024-04-08,Floor administration save home green when employee.
karina04302,Logro_1_choice,2024-05-30,Hard without camera side because difficult message do.
karina04302,Logro_2_such,2023-12-07,Tell international prove own discussion family.
poncebradley303,Logro_0_find,2024-07-22,Plan image learn hope support ever set.
poncebradley303,Logro_1_appear,2024-11-01,Seek finish shoulder American available son energy radio.
poncebradley303,Logro_2_doctor,2024-08-14,Trial deal perform fine.
timothyjones304,Logro_0_debate,2024-07-28,Or prepare occur per not.
timothyjones304,Logro_1_able,2024-04-18,Conference mission risk operation quality feeling soldier.
timothyjones304,Logro_2_woman,2024-10-27,Then lead up last soldier.
randywest305,Logro_0_country,2024-07-12,Really others eight lawyer here air.
randywest305,Logro_1_night,2024-03-04,Give certain peace.
randywest305,Logro_2_system,2024-08-05,Wrong produce word fight poor popular.
edwardsthomas306,Logro_0_hundred,2024-06-19,Where civil area real draw.
edwardsthomas306,Logro_1_back,2024-07-11,Dinner stand work chair hold early quickly turn.
edwardsthomas306,Logro_2_line,2024-07-31,Adult marriage home traditional.
mallorythompson307,Logro_0_alone,2024-11-13,Analysis enough when first which report.
mallorythompson307,Logro_1_though,2024-07-16,Follow between listen social carry rule.
mallorythompson307,Logro_2_process,2024-01-27,Record mission field model meeting us employee.
aliciahines308,Logro_0_look,2024-09-23,Woman model fight certainly American example movement long.
aliciahines308,Logro_1_myself,2023-12-06,Investment our quite up answer miss great.
aliciahines308,Logro_2_direction,2024-02-20,Perhaps speak process paper young everything third.
sayala309,Logro_0_whom,2024-04-08,Away doctor lawyer live.
sayala309,Logro_1_different,2024-08-20,Image forward American glass into let push.
sayala309,Logro_2_then,2024-02-10,Exist campaign risk about.
andersonbrittany310,Logro_0_important,2024-03-18,Poor fire lot event present care quality.
andersonbrittany310,Logro_1_option,2024-01-29,Reason admit south society compare ability consumer find.
andersonbrittany310,Logro_2_condition,2024-11-07,Month want say rather road.
kristenriley311,Logro_0_reality,2024-03-04,Mrs building training improve.
kristenriley311,Logro_1_between,2024-06-14,Me this quality drop space easy something moment.
kristenriley311,Logro_2_break,2024-02-21,Decade crime safe arrive myself voice.
bowen312,Logro_0_hand,2024-10-03,Me just station family.
bowen312,Logro_1_treatment,2024-01-20,Interest part seven page.
bowen312,Logro_2_home,2024-08-11,Building science cost under shake family writer.
marshallricky313,Logro_0_certainly,2023-12-12,Throughout baby hard consider begin figure song.
marshallricky313,Logro_1_conference,2024-06-17,Scientist well feel major second.
marshallricky313,Logro_2_nearly,2024-06-11,Case time around most manager.
sally44314,Logro_0_generation,2024-06-05,Recent heavy consumer skill kid that there.
sally44314,Logro_1_manage,2024-10-09,Vote left including would civil.
sally44314,Logro_2_people,2023-12-13,Goal space door director treat action toward nice.
arnoldmarcus315,Logro_0_seem,2024-06-26,Its condition per side.
arnoldmarcus315,Logro_1_long,2023-12-17,Mother natural guess operation find.
arnoldmarcus315,Logro_2_window,2024-06-28,Activity although child attention myself project.
kiara11316,Logro_0_couple,2024-08-11,Meet pretty thing ever shake.
kiara11316,Logro_1_computer,2024-05-24,Final environmental evidence game.
kiara11316,Logro_2_not,2024-01-27,Them walk do capital anyone.
zachary93317,Logro_0_message,2023-12-27,Other know morning appear society because.
zachary93317,Logro_1_mouth,2024-05-17,Seem beat leader identify yard pass.
zachary93317,Logro_2_clear,2024-04-24,Generation tax car theory energy.
matthew46318,Logro_0_bag,2024-05-05,Say believe order still.
matthew46318,Logro_1_sure,2023-12-17,A goal health head determine social.
matthew46318,Logro_2_who,2024-10-05,Fill board visit rule box night forward fill.
knoxantonio319,Logro_0_future,2024-03-24,Include strategy customer describe know operation analysis.
knoxantonio319,Logro_1_almost,2024-07-11,Stuff piece admit rock public site.
knoxantonio319,Logro_2_central,2024-03-12,Evening same do easy tonight time suffer.
uvincent320,Logro_0_situation,2024-07-16,Strategy positive service carry include.
uvincent320,Logro_1_company,2024-09-20,Age eat often either thus sign.
uvincent320,Logro_2_cold,2024-09-11,Only activity everybody strong professional meeting.
vaughnbenjamin321,Logro_0_pretty,2024-07-11,Part need question we.
vaughnbenjamin321,Logro_1_why,2024-07-06,Those travel manage outside end run.
vaughnbenjamin321,Logro_2_party,2024-11-12,Entire small allow understand.
jeffrey34322,Logro_0_report,2024-06-30,Talk weight edge involve.
jeffrey34322,Logro_1_very,2024-06-17,Including able floor.
jeffrey34322,Logro_2_gun,2024-07-16,Else around teacher major play outside.
fmiranda323,Logro_0_soldier,2024-08-20,That author resource hundred.
fmiranda323,Logro_1_have,2024-08-23,School so better above cover director keep offer.
fmiranda323,Logro_2_technology,2024-06-20,American order standard up race together.
tony91324,Logro_0_compare,2024-09-07,Help about sign energy thousand maybe hard.
tony91324,Logro_1_understand,2024-03-05,Authority wife affect some foreign.
tony91324,Logro_2_include,2024-07-19,Cold he goal example catch.
brentobrien325,Logro_0_guy,2024-08-04,Detail wife agent around growth different even.
brentobrien325,Logro_1_full,2024-05-28,Time page agency.
brentobrien325,Logro_2_student,2024-07-04,Know take former rather position.
qscott326,Logro_0_point,2024-04-10,Day fast develop college.
qscott326,Logro_1_glass,2024-04-14,Side admit light test man option set spring.
qscott326,Logro_2_own,2024-09-19,Others style key owner page.
amy85327,Logro_0_factor,2023-11-26,Memory family none hot their simple identify.
amy85327,Logro_1_happy,2024-10-17,Cup front live some sing degree.
amy85327,Logro_2_wall,2024-07-18,Large assume social deep walk water threat.
pwalker328,Logro_0_throw,2024-03-06,Support after part involve note through improve.
pwalker328,Logro_1_trial,2024-10-14,Food member serious discover card such listen type.
pwalker328,Logro_2_ok,2024-10-08,View generation western economy.
toni95329,Logro_0_day,2024-05-28,Short play police significant.
toni95329,Logro_1_direction,2024-03-24,Set man within college mention say.
toni95329,Logro_2_people,2023-12-05,Read poor different feeling or.
richardsonkenneth330,Logro_0_open,2024-01-13,Let science how thousand activity.
richardsonkenneth330,Logro_1_nice,2024-01-30,Say chance stuff.
richardsonkenneth330,Logro_2_skill,2023-12-11,Opportunity person responsibility product drop away.
jessica99331,Logro_0_and,2024-08-27,Realize order hear knowledge white magazine.
jessica99331,Logro_1_after,2024-04-20,Weight thing like professional eye trial subject.
jessica99331,Logro_2_wife,2024-07-13,Even style lose wide bill.
rebekah04332,Logro_0_simple,2024-04-06,Difficult range commercial true.
rebekah04332,Logro_1_chair,2024-02-12,Tv foot choice arm.
rebekah04332,Logro_2_can,2024-01-17,Stand media describe whether collection stop.
jennifer45333,Logro_0_evening,2024-04-02,Maintain whose purpose think start tend.
jennifer45333,Logro_1_environment,2024-06-08,Party suddenly organization media both.
jennifer45333,Logro_2_yourself,2024-04-10,Score describe week.
janethansen334,Logro_0_home,2024-08-02,Law try four lead to group.
janethansen334,Logro_1_recently,2024-05-14,Full father open hot that.
janethansen334,Logro_2_strategy,2024-05-23,Side south pretty sing.
amandaadams335,Logro_0_grow,2024-11-12,State sing foreign.
amandaadams335,Logro_1_be,2024-05-15,May herself foreign rich traditional along.
amandaadams335,Logro_2_laugh,2023-12-15,Miss increase bit show.
leemichael336,Logro_0_billion,2024-06-07,Director remember choose join.
leemichael336,Logro_1_run,2024-06-12,Fast film traditional plan.
leemichael336,Logro_2_less,2024-10-23,While base action whatever situation authority find else.
victoriaward337,Logro_0_you,2023-12-25,Cell test according region.
victoriaward337,Logro_1_however,2024-09-08,If issue sound agree cut certainly born fall.
victoriaward337,Logro_2_along,2024-02-12,Necessary education local wear there structure.
raymond97338,Logro_0_citizen,2024-03-20,Create write cause enjoy glass.
raymond97338,Logro_1_school,2024-02-29,Man them bit the security.
raymond97338,Logro_2_drop,2024-08-11,Within nature activity challenge get game.
nrodriguez339,Logro_0_accept,2024-07-07,Body stuff around scene method strong while.
nrodriguez339,Logro_1_future,2024-08-20,Increase charge participant total accept.
nrodriguez339,Logro_2_film,2024-06-09,Eat black may continue now present where know.
